screening_id,candidate_id,rank,title,decision,decision_confidence,reason_code,reason_note,likely_paper_type,likely_dataset_relationship,named_datasets,agricultural_domain,vision_task,modalities,relevance_yes,relevance_unclear,abstract_available,full_text_available,identity_status,reviewer,model,protocol_version,screened_at,batch_id,source_queue_sha256,supersedes_screening_id,notes
TA_R0041,doi:10.3390/agriculture16020215,41,Intelligent Evaluation of Rice Resistance to White-Backed Planthopper (Sogatella furcifera) Based on 3D Point Clouds and Deep Learning,include,high,I01;I06,Introduces 3D Rice WBPH Damage dataset; point cloud segmentation for rice phenotyping,dataset_paper,introduces_dataset,3D_Rice_WBPH_Damage,rice;phenotyping,semantic_segmentation,3D;point_cloud,semantic_segmentation;3d_vision;lidar_or_point_cloud,,yes,unknown,confirmed,opencode_ai,deepseek-v4-flash-free,AI_SCREENING_V1,2026-07-22T16:25:00Z,B003,feb7c8a80978b97f3bdcffd7291708e8ac5282301ce06c793247227bc43712be,,
TA_R0042,doi:10.1016/j.dib.2026.112642,42,TomatoPGT: A 3D point cloud dataset of tomato plants for segmentation and plant-trait extraction,include,high,I01,TomatoPGT seed paper in Data in Brief; 3D tomato point cloud dataset for segmentation and phenotyping,dataset_paper,introduces_dataset,TomatoPGT,tomato;phenotyping,semantic_segmentation;instance_segmentation,3D;point_cloud;RGB,semantic_segmentation;instance_segmentation;3d_vision;lidar_or_point_cloud,,yes,unknown,confirmed,opencode_ai,deepseek-v4-flash-free,AI_SCREENING_V1,2026-07-22T16:25:00Z,B003,feb7c8a80978b97f3bdcffd7291708e8ac5282301ce06c793247227bc43712be,,
TA_R0043,doi:10.1016/j.atech.2025.101020,43,Sensing Technology for Greenhouse Tomato Production: A Systematic Review,include,high,I10,"Systematic review of sensing technologies for greenhouse tomato production; multispectral, IoT, deep learning",survey_or_review,no_dataset_relationship,,greenhouse;tomato,classification;detection,multispectral;multimodal,classification;multispectral;multimodal,,yes,unknown,confirmed,opencode_ai,deepseek-v4-flash-free,AI_SCREENING_V1,2026-07-22T16:25:00Z,B003,feb7c8a80978b97f3bdcffd7291708e8ac5282301ce06c793247227bc43712be,,
TA_R0044,doi:10.48550/arxiv.2403.00566,44,Lincoln's Annotated Spatio-Temporal Strawberry Dataset (LAST-Straw),include,high,I01;I06,LAST-Straw spatio-temporal 3D strawberry point cloud dataset for phenotyping,dataset_paper,introduces_dataset,LAST-Straw,strawberry;phenotyping,semantic_segmentation;instance_segmentation,3D;point_cloud;multitemporal,semantic_segmentation;instance_segmentation;3d_vision;lidar_or_point_cloud;multitemporal,,yes,unknown,confirmed,opencode_ai,deepseek-v4-flash-free,AI_SCREENING_V1,2026-07-22T16:25:00Z,B003,feb7c8a80978b97f3bdcffd7291708e8ac5282301ce06c793247227bc43712be,,
TA_R0045,doi:10.1109/iros60139.2025.11246612,45,Wireless Collaborative Inference Acceleration Based on Distillation for Weed Detection and Instance Segmentation,include,high,I05;I07,Wireless collaborative inference for weed detection and instance segmentation; knowledge distillation,method_paper,uses_dataset_experimentally,WeedsGalore,weeds,instance_segmentation;object_detection,RGB,instance_segmentation;object_detection,,yes,unknown,confirmed,opencode_ai,deepseek-v4-flash-free,AI_SCREENING_V1,2026-07-22T16:25:00Z,B003,feb7c8a80978b97f3bdcffd7291708e8ac5282301ce06c793247227bc43712be,,
TA_R0046,doi:10.3390/rs17030445,46,Forest Stem Extraction and Modeling (FoSEM): A LiDAR-Based Framework for Accurate Tree Stem Extraction and Modeling in Radiata Pine Plantations,exclude,high,E03_NO_DATASET_RELEVANCE,Forestry-focused LiDAR framework for Radiata pine timber inventory; not agricultural crop CV,method_paper,no_dataset_relationship,,forestry,semantic_segmentation,LiDAR;point_cloud,semantic_segmentation;3d_vision;lidar_or_point_cloud,,yes,unknown,confirmed,opencode_ai,deepseek-v4-flash-free,AI_SCREENING_V1,2026-07-22T16:25:00Z,B003,feb7c8a80978b97f3bdcffd7291708e8ac5282301ce06c793247227bc43712be,,
TA_R0047,doi:10.1016/j.compag.2024.109607,47,An automatic 3D tomato plant stemwork phenotyping pipeline at internode level based on tree quantitative structural modelling algorithm,include,high,I05;I06,3D tomato stemwork phenotyping pipeline using PointNet++ and TreeQSM at internode level,method_paper,uses_dataset_experimentally,TomatoWUR,tomato;phenotyping,semantic_segmentation,3D;point_cloud;RGB,semantic_segmentation;3d_vision;lidar_or_point_cloud,,yes,unknown,confirmed,opencode_ai,deepseek-v4-flash-free,AI_SCREENING_V1,2026-07-22T16:25:00Z,B003,feb7c8a80978b97f3bdcffd7291708e8ac5282301ce06c793247227bc43712be,,
TA_R0048,doi:10.48550/arxiv.2404.02580,48,Active learning for efficient annotation in precision agriculture: a use-case on crop-weed semantic segmentation,include,high,I03;I05,Active learning for efficient annotation in crop-weed segmentation; Sugarbeet and Corn-Weed datasets,method_paper,uses_dataset_experimentally,Sugarbeet;Corn-Weed,crops;weeds,semantic_segmentation,RGB,semantic_segmentation,,yes,unknown,confirmed,opencode_ai,deepseek-v4-flash-free,AI_SCREENING_V1,2026-07-22T16:25:00Z,B003,feb7c8a80978b97f3bdcffd7291708e8ac5282301ce06c793247227bc43712be,,
TA_R0049,doi:10.1109/iros58592.2024.10802820,49,BonnBeetClouds3D: A Dataset Towards Point Cloud-Based Organ-Level Phenotyping of Sugar Beet Plants Under Real Field Conditions,include,high,I01;I06,BonnBeetClouds3D: UAV point cloud dataset for organ-level sugar beet phenotyping under field conditions,dataset_paper,introduces_dataset,BonnBeetClouds3D,sugar_beet;phenotyping,instance_segmentation,3D;point_cloud;UAV,instance_segmentation;3d_vision;uav;lidar_or_point_cloud,,yes,unknown,confirmed,opencode_ai,deepseek-v4-flash-free,AI_SCREENING_V1,2026-07-22T16:25:00Z,B003,feb7c8a80978b97f3bdcffd7291708e8ac5282301ce06c793247227bc43712be,,
TA_R0050,doi:10.3390/plants15081218,50,"Ground Mobile Robots for High-Throughput Plant Phenotyping: A Review from the Closed-Loop Perspective of Perception, Decision, and Action",include,high,I10,Review of ground mobile robots for HTPP from perception-decision-action closed-loop perspective,survey_or_review,no_dataset_relationship,,general_agriculture;phenotyping,perception;localization;planning,multimodal;UAV;UGV,phenotyping;uav;robotics;multimodal,,yes,unknown,confirmed,opencode_ai,deepseek-v4-flash-free,AI_SCREENING_V1,2026-07-22T16:25:00Z,B003,feb7c8a80978b97f3bdcffd7291708e8ac5282301ce06c793247227bc43712be,,
TA_R0051,doi:10.1016/j.compag.2022.107388,51,Deep learning-based early weed segmentation using motion blurred UAV images of sorghum fields,include,high,I01;I07,Early weed segmentation using motion blurred UAV images; introduces annotated sorghum weed dataset,dataset_paper,introduces_dataset,UAVWeedSegmentation,sorghum;weeds,semantic_segmentation,RGB;UAV,semantic_segmentation;uav;corrupted_input;uncertainty,,yes,unknown,confirmed,opencode_ai,deepseek-v4-flash-free,AI_SCREENING_V1,2026-07-22T16:25:00Z,B003,feb7c8a80978b97f3bdcffd7291708e8ac5282301ce06c793247227bc43712be,,
TA_R0052,doi:10.3390/agriculture13071321,52,Soybean-MVS: Annotated Three-Dimensional Model Dataset of Whole Growth Period Soybeans for 3D Plant Organ Segmentation,include,high,I01,Soybean-MVS: annotated 3D model dataset of whole growth period soybeans for organ segmentation,dataset_paper,introduces_dataset,Soybean-MVS,soybean;phenotyping,semantic_segmentation,3D;point_cloud,semantic_segmentation;3d_vision;lidar_or_point_cloud,,yes,unknown,confirmed,opencode_ai,deepseek-v4-flash-free,AI_SCREENING_V1,2026-07-22T16:25:00Z,B003,feb7c8a80978b97f3bdcffd7291708e8ac5282301ce06c793247227bc43712be,,
TA_R0053,doi:10.1109/tpami.2024.3419548,53,PhenoBench: A Large Dataset and Benchmarks for Semantic Image Interpretation in the Agricultural Domain,include,high,I01;I04,PhenoBench: large dataset and benchmarks for semantic interpretation in agriculture; UAV crop-weed-leaf instance segmentation,dataset_paper,introduces_dataset,PhenoBench,crops;weeds;general_agriculture,semantic_segmentation;instance_segmentation,RGB;UAV,semantic_segmentation;instance_segmentation;uav,,yes,unknown,confirmed,opencode_ai,deepseek-v4-flash-free,AI_SCREENING_V1,2026-07-22T16:25:00Z,B003,feb7c8a80978b97f3bdcffd7291708e8ac5282301ce06c793247227bc43712be,,
TA_R0054,doi:10.1109/iros60139.2025.11246227,54,Zero-Shot Semantic Segmentation for Robots in Agriculture,include,high,I05;I08,Zero-shot unsupervised crop-weed segmentation using foundation model features and anomaly detection,method_paper,uses_dataset_experimentally,unknown,crops;weeds,semantic_segmentation,RGB,semantic_segmentation,,yes,unknown,confirmed,opencode_ai,deepseek-v4-flash-free,AI_SCREENING_V1,2026-07-22T16:25:00Z,B003,feb7c8a80978b97f3bdcffd7291708e8ac5282301ce06c793247227bc43712be,,
TA_R0055,doi:10.1109/dicta63115.2024.00095,55,Multispectral Remote Sensing for Weed Detection in West Australian Agricultural Lands,include,high,I01;I06,Multispectral remote sensing weed detection framework with custom WA dataset; vegetation indices + deep learning,method_paper,introduces_dataset,Kondinin_Weed_MS,weeds;general_agriculture,classification;detection,multispectral;UAV;remote_sensing,classification;remote_sensing;uav;multispectral,,yes,unknown,confirmed,opencode_ai,deepseek-v4-flash-free,AI_SCREENING_V1,2026-07-22T16:25:00Z,B003,feb7c8a80978b97f3bdcffd7291708e8ac5282301ce06c793247227bc43712be,,
TA_R0056,doi:10.1109/iccraids67816.2026.11519698,56,A Comparative Study of Deep Learning and Classical Image Segmentation Methods for Damaged Flower Image Analysis,include,medium,I05,Comparative study of DL vs classical segmentation for damaged flower detection; U-Net and TransUNet,method_paper,uses_dataset_experimentally,unknown,flowers;quality_assessment,semantic_segmentation,RGB,semantic_segmentation,,yes,unknown,confirmed,opencode_ai,deepseek-v4-flash-free,AI_SCREENING_V1,2026-07-22T16:25:00Z,B003,feb7c8a80978b97f3bdcffd7291708e8ac5282301ce06c793247227bc43712be,,
TA_R0057,arxiv:260522366,57,AgroTools: A Benchmark for Tool-Augmented Multimodal Agents in Agriculture,include,high,I04;I09,AgroTools: benchmark for tool-augmented multimodal agents in agriculture with 539 QA instances,benchmark_or_challenge,benchmarks_dataset,AgroTools,general_agriculture,visual_question_answering;tool_use,RGB;multimodal,multimodal,,yes,unknown,confirmed,opencode_ai,deepseek-v4-flash-free,AI_SCREENING_V1,2026-07-22T16:25:00Z,B003,feb7c8a80978b97f3bdcffd7291708e8ac5282301ce06c793247227bc43712be,,
TA_R0058,doi:10.3389/fpls.2025.1655391,58,Deep learning-based temporal change detection of broadleaved weed infestation in rice fields using UAV multispectral imagery,include,high,I05;I06,DL temporal change detection of broadleaved weed infestation in rice using UAV multispectral imagery,method_paper,uses_dataset_experimentally,unknown,rice;weeds,classification;change_detection,multispectral;UAV,classification;uav;multispectral,,yes,unknown,confirmed,opencode_ai,deepseek-v4-flash-free,AI_SCREENING_V1,2026-07-22T16:25:00Z,B003,feb7c8a80978b97f3bdcffd7291708e8ac5282301ce06c793247227bc43712be,,
TA_R0059,doi:10.1145/3799830.3799845,59,DLA-HybridNet: Governance-Aware Edge Segmentation via Hybrid Aggregation Distillation,exclude,medium,E03_NO_DATASET_RELEVANCE,Segmentation method demonstrated on medical imagery; agriculture mentioned only as potential application; no ag eval,method_paper,no_dataset_relationship,,general,semantic_segmentation,RGB,semantic_segmentation,,yes,unknown,confirmed,opencode_ai,deepseek-v4-flash-free,AI_SCREENING_V1,2026-07-22T16:25:00Z,B003,feb7c8a80978b97f3bdcffd7291708e8ac5282301ce06c793247227bc43712be,,
TA_R0060,doi:10.1038/s41598-018-38343-3,60,DeepWeeds: A Multiclass Weed Species Image Dataset for Deep Learning,include,high,I01,"DeepWeeds: large multiclass weed species image dataset from Australian rangelands; 17,509 labeled images",dataset_paper,introduces_dataset,DeepWeeds,weeds;rangeland,classification,RGB,classification,,yes,unknown,confirmed,opencode_ai,deepseek-v4-flash-free,AI_SCREENING_V1,2026-07-22T16:25:00Z,B003,feb7c8a80978b97f3bdcffd7291708e8ac5282301ce06c793247227bc43712be,,
