rank,candidate_id,title,year,authors,venue,doi,arxiv_id,pmid,pmcid,providers,provider_ids,seed_ids,dataset_names,directions,is_open_access,landing_url,pdf_url,abstract
315,doi:10.48550/arxiv.2506.10137,Self-Predictive Representations for Combinatorial Generalization in Behavioral Cloning,2025,Daniel Lawson; Adriana Hugessen; Charlotte Cloutier; Glen Berseth; Khimya Khetarpal,arXiv.org,10.48550/arxiv.2506.10137,2506.10137,,,semantic_scholar,semantic_scholar:0185e9d335b59655598966e75511a2c338c4eec6,P011,PlantSeg,forward_citation,False,https://www.semanticscholar.org/paper/0185e9d335b59655598966e75511a2c338c4eec6,,"While goal-conditioned behavior cloning (GCBC) methods can perform well on in-distribution training tasks, they do not necessarily generalize zero-shot to tasks that require conditioning on novel state-goal pairs, i.e. combinatorial generalization. In part, this limitation can be attributed to a lack of temporal consistency in the state representation learned by BC; if temporally correlated states are properly encoded to similar latent representations, then the out-of-distribution gap for novel state-goal pairs would be reduced. We formalize this notion by demonstrating how encouraging long-range temporal consistency via successor representations (SR) can facilitate generalization. We then propose a simple yet effective representation learning objective, $\text{BYOL-}\gamma$ for GCBC, which theoretically approximates the successor representation in the finite MDP case through self-predictive representations, and achieves competitive empirical performance across a suite of challenging tasks requiring combinatorial generalization."
316,doi:10.3390/agronomy12010118,Sustainable Approach to Weed Management: The Role of Precision Weed Management,2022,António Monteiro; Sérgio Ribeiro dos Santos,Agronomy,10.3390/agronomy12010118,,,,openalex,openalex:W4205616618,P010,WeedsGalore,backward_reference,True,https://doi.org/10.3390/agronomy12010118,https://www.mdpi.com/2073-4395/12/1/118/pdf?version=1641283338,"In the last few decades, the increase in the world’s population has created a need to produce more food, generating, consequently, greater pressure on agricultural production. In addition, problems related to climate change, water scarcity or decreasing amounts of arable land have serious implications for farming sustainability. Weeds can affect food production in agricultural systems, decreasing the product quality and productivity due to the competition for natural resources. On the other hand, weeds can also be considered to be valuable indicators of biodiversity because of their role in providing ecosystem services. In this sense, there is a need to carry out an effective and sustainable weed management process, integrating the various control methods (i.e., cultural, mechanical and chemical) in a harmonious way, without harming the entire agrarian ecosystem. Thus, intensive mechanization and herbicide use should be avoided. Herbicide resistance in some weed biotypes is a major concern today and must be tackled. On the other hand, the recent development of weed control technologies can promote higher levels of food production, lower the amount of inputs needed and reduce environmental damage, invariably bringing us closer to more sustainable agricultural systems. In this paper, we review the most common conventional and non-conventional weed control strategies from a sustainability perspective, highlighting the application of the precision and automated weed control technologies associated with precision weed management (PWM)."
317,doi:10.1109/access.2023.3249759,Assessing Inter-Annotator Agreement for Medical Image Segmentation,2023,Feng Yang; Ghada Zamzmi; Sandeep Angara; Sivaramakrishnan Rajaraman; André Aquilina; Zhiyun Xue; Stefan Jaeger; Emmanouil Papagiannakis; Sameer Antani,IEEE Access,10.1109/access.2023.3249759,,37008654,10062409,openalex; semantic_scholar,openalex:W4323519388; semantic_scholar:872507dd2aae050c01202f79af0f5f7985602210,P002,TomatoMAP,backward_reference,True,https://www.semanticscholar.org/paper/872507dd2aae050c01202f79af0f5f7985602210,https://ieeexplore.ieee.org/ielx7/6287639/10005208/10054393.pdf,"Artificial Intelligence (AI)-based medical computer vision algorithm training and evaluations depend on annotations and labeling. However, variability between expert annotators introduces noise in training data that can adversely impact the performance of AI algorithms. This study aims to assess, illustrate and interpret the inter-annotator agreement among multiple expert annotators when segmenting the same lesion(s)/abnormalities on medical images. We propose the use of three metrics for the qualitative and quantitative assessment of inter-annotator agreement: 1) use of a common agreement heatmap and a ranking agreement heatmap; 2) use of the extended Cohen's kappa and Fleiss' kappa coefficients for a quantitative evaluation and interpretation of inter-annotator reliability; and 3) use of the Simultaneous Truth and Performance Level Estimation (STAPLE) algorithm, as a parallel step, to generate ground truth for training AI models and compute Intersection over Union (IoU), sensitivity, and specificity to assess the inter-annotator reliability and variability. Experiments are performed on two datasets, namely cervical colposcopy images from 30 patients and chest X-ray images from 336 tuberculosis (TB) patients, to demonstrate the consistency of inter-annotator reliability assessment and the importance of combining different metrics to avoid bias assessment."
318,doi:10.48550/arxiv.2602.21445,VLA Knows Its Limits,2026,Haoxuan Wang; Gengyu Zhang; Yan Yan; R. Kompella; Gaowen Liu,arXiv.org,10.48550/arxiv.2602.21445,2602.21445,,,semantic_scholar,semantic_scholar:d94cb187365c031664ff5c51a204fb336f99fa8d,P011,PlantSeg,forward_citation,False,https://www.semanticscholar.org/paper/d94cb187365c031664ff5c51a204fb336f99fa8d,,"Action chunking has recently emerged as a standard practice in flow-based Vision-Language-Action (VLA) models. However, the effect and choice of the execution horizon - the number of actions to be executed from each predicted chunk - remains underexplored. In this work, we first show that varying the execution horizon leads to substantial performance deviations, with performance initially improving and then declining as the horizon increases. To uncover the reasons, we analyze the cross- and self-attention weights in flow-based VLAs and reveal two key phenomena: (i) intra-chunk actions attend invariantly to vision-language tokens, limiting adaptability to environmental changes; and (ii) the initial and terminal action tokens serve as stable anchors, forming latent centers around which intermediate actions are organized. Motivated by these insights, we interpret action self-attention weights as a proxy for the model's predictive limit and propose AutoHorizon, the first test-time method that dynamically estimates the execution horizon for each predicted action chunk to adapt to changing perceptual conditions. Across simulated and real-world robotic manipulation tasks, AutoHorizon is performant, incurs negligible computational overhead, and generalizes across diverse tasks and flow-based models."
319,doi:10.1007/s10343-024-01054-z,Advanced CNN Approach for Segmentation of Diseased Areas in Plant Images,2024,Abdullah Şener; Burhan Ergen,Journal of Crop Health,10.1007/s10343-024-01054-z,,,,openalex; semantic_scholar,openalex:W4403759714; semantic_scholar:fc3b0ba45bd3a2f295065917440c2c287a427c74,P011,PlantSeg,backward_reference,False,https://www.semanticscholar.org/paper/fc3b0ba45bd3a2f295065917440c2c287a427c74,,
320,doi:10.1002/rob.21938,Robotic weed control using automated weed and crop classification,2020,Xiaolong Wu; Stéphanie Aravecchia; Philipp Lottes; Cyrill Stachniss; Cédric Pradalier,Journal of Field Robotics,10.1002/rob.21938,,,,openalex; semantic_scholar,openalex:W3004479823; semantic_scholar:de55125fd720d7ccfa2640a92a8f955d72bb3d22,P010,WeedsGalore,backward_reference,False,https://www.semanticscholar.org/paper/de55125fd720d7ccfa2640a92a8f955d72bb3d22,https://hal.archives-ouvertes.fr/hal-02484462/file/jfr_final_v1.pdf,"Abstract Autonomous robotic weeding systems in precision farming have demonstrated their full potential to alleviate the current dependency on agrochemicals such as herbicides and pesticides, thus reducing environmental pollution and improving sustainability. However, most previous works require fast and constant‐time weed detection systems to achieve real‐time treatment, which forecloses the implementation of more capable but time‐consuming algorithms, for example, learning‐based methods. In this paper, a nonoverlapping multicamera system is applied to provide flexibility for the weed control system in dealing with the indeterminate classification delays. The design, implementation, and testing of our proposed modular weed control unit with mechanical and chemical weeding tools are presented. A framework that performs naive Bayes filtering, 3D direct intra‐ and inter‐camera visual tracking, and predictive control, while integrating state‐of‐the‐art crop/weed detection algorithms, is developed to guide the tools to achieve high‐precision weed removal. The experimental results show that our proposed fully operational weed control system is capable of performing selective mechanical as well as chemical in‐row weeding with indeterminate detection delays in different terrain conditions and crop growth stages."
