screening_id,candidate_id,rank,title,decision,decision_confidence,reason_code,reason_note,likely_paper_type,likely_dataset_relationship,named_datasets,agricultural_domain,vision_task,modalities,relevance_yes,relevance_unclear,abstract_available,full_text_available,identity_status,reviewer,model,protocol_version,screened_at,batch_id,source_queue_sha256,supersedes_screening_id,notes
TA_R0141,doi:10.48550/arxiv.2510.23763,141,RoboOmni: Proactive Robot Manipulation in Omni-modal Context,,,,,,,,,,,,,yes,unknown,confirmed,opencode_ai,,AI_SCREENING_V1,,B008,feb7c8a80978b97f3bdcffd7291708e8ac5282301ce06c793247227bc43712be,,
TA_R0142,doi:10.1007/978-3-031-20056-4_22,142,HRDA: Context-Aware High-Resolution Domain-Adaptive Semantic Segmentation,,,,,,,,,,,,,yes,unknown,confirmed,opencode_ai,,AI_SCREENING_V1,,B008,feb7c8a80978b97f3bdcffd7291708e8ac5282301ce06c793247227bc43712be,,
TA_R0143,doi:10.1109/cvpr42600.2020.01262,143,xMUDA: Cross-Modal Unsupervised Domain Adaptation for 3D Semantic Segmentation,,,,,,,,,,,,,yes,unknown,confirmed,opencode_ai,,AI_SCREENING_V1,,B008,feb7c8a80978b97f3bdcffd7291708e8ac5282301ce06c793247227bc43712be,,
TA_R0144,doi:10.5281/zenodo.17217565,144,2023-2025 Tomato dataset,,,,,,,,,,,,,yes,unknown,confirmed,opencode_ai,,AI_SCREENING_V1,,B008,feb7c8a80978b97f3bdcffd7291708e8ac5282301ce06c793247227bc43712be,,
TA_R0145,doi:10.6084/m9.figshare.29222462,145,AgriVision: A Benchmark Dataset for Advancing Real-World Robotic Vision in Densely Fruited Blueberry Crop,,,,,,,,,,,,,yes,unknown,confirmed,opencode_ai,,AI_SCREENING_V1,,B008,feb7c8a80978b97f3bdcffd7291708e8ac5282301ce06c793247227bc43712be,,
TA_R0146,doi:10.1145/3581783.3611708,146,PiPa: Pixel- and Patch-wise Self-supervised Learning for Domain Adaptative Semantic Segmentation,,,,,,,,,,,,,yes,unknown,confirmed,opencode_ai,,AI_SCREENING_V1,,B008,feb7c8a80978b97f3bdcffd7291708e8ac5282301ce06c793247227bc43712be,,
TA_R0147,doi:10.1016/j.aiia.2024.07.001,147,Comparing YOLOv8 and Mask R-CNN for instance segmentation in complex orchard environments,,,,,,,,,,,,,yes,unknown,confirmed,opencode_ai,,AI_SCREENING_V1,,B008,feb7c8a80978b97f3bdcffd7291708e8ac5282301ce06c793247227bc43712be,,
TA_R0148,doi:10.1145/3696409.3700293,148,Snap and Diagnose: An Advanced Multimodal Retrieval System for Identifying Plant Diseases in the Wild,,,,,,,,,,,,,yes,unknown,confirmed,opencode_ai,,AI_SCREENING_V1,,B008,feb7c8a80978b97f3bdcffd7291708e8ac5282301ce06c793247227bc43712be,,
TA_R0149,doi:10.34133/plantphenomics.0080,149,Eff-3DPSeg: 3D Organ-Level Plant Shoot Segmentation Using Annotation-Efficient Deep Learning,,,,,,,,,,,,,yes,unknown,confirmed,opencode_ai,,AI_SCREENING_V1,,B008,feb7c8a80978b97f3bdcffd7291708e8ac5282301ce06c793247227bc43712be,,
TA_R0150,doi:10.1016/j.compag.2022.107091,150,Performance Evaluation of Deep Transfer Learning on Multiclass Identification of Common Weed Species in Cotton Production Systems,,,,,,,,,,,,,yes,unknown,confirmed,opencode_ai,,AI_SCREENING_V1,,B008,feb7c8a80978b97f3bdcffd7291708e8ac5282301ce06c793247227bc43712be,,
TA_R0151,doi:10.1109/wacv56688.2023.00236,151,Cross-task Attention Mechanism for Dense Multi-task Learning,,,,,,,,,,,,,yes,unknown,confirmed,opencode_ai,,AI_SCREENING_V1,,B008,feb7c8a80978b97f3bdcffd7291708e8ac5282301ce06c793247227bc43712be,,
TA_R0152,doi:10.1109/access.2020.2991354,152,Semantic Segmentation of Crop and Weed using an Encoder-Decoder Network and Image Enhancement Method under Uncontrolled Outdoor Illumination,,,,,,,,,,,,,yes,unknown,confirmed,opencode_ai,,AI_SCREENING_V1,,B008,feb7c8a80978b97f3bdcffd7291708e8ac5282301ce06c793247227bc43712be,,
TA_R0153,doi:10.1016/j.mex.2025.103169,153,Modification of an automated precision farming robot for high temporal resolution measurement of leaf angle dynamics using stereo vision,,,,,,,,,,,,,yes,unknown,confirmed,opencode_ai,,AI_SCREENING_V1,,B008,feb7c8a80978b97f3bdcffd7291708e8ac5282301ce06c793247227bc43712be,,
TA_R0154,doi:10.1007/s11119-024-10202-4,154,Structural wheat trait estimation using UAV-based laser scanning data: Analysis of critical aspects and recommendations based on a case study,,,,,,,,,,,,,yes,unknown,confirmed,opencode_ai,,AI_SCREENING_V1,,B008,feb7c8a80978b97f3bdcffd7291708e8ac5282301ce06c793247227bc43712be,,
TA_R0155,doi:10.3389/fpls.2024.1439086,155,NeRF-based 3D reconstruction pipeline for acquisition and analysis of tomato crop morphology,,,,,,,,,,,,,yes,unknown,confirmed,opencode_ai,,AI_SCREENING_V1,,B008,feb7c8a80978b97f3bdcffd7291708e8ac5282301ce06c793247227bc43712be,,
TA_R0156,doi:10.1109/wacv57701.2024.00693,156,Towards Accurate Disease Segmentation in Plant Images: A Comprehensive Dataset Creation and Network Evaluation,,,,,,,,,,,,,yes,unknown,confirmed,opencode_ai,,AI_SCREENING_V1,,B008,feb7c8a80978b97f3bdcffd7291708e8ac5282301ce06c793247227bc43712be,,
TA_R0157,doi:10.3389/fpls.2026.1779398,157,Digital morphological data can generate accurate pre-emergence herbicide dose-response curves in Chenopodium album L,,,,,,,,,,,,,yes,unknown,confirmed,opencode_ai,,AI_SCREENING_V1,,B008,feb7c8a80978b97f3bdcffd7291708e8ac5282301ce06c793247227bc43712be,,
TA_R0158,doi:10.1109/icpics66386.2025.11347300,158,Research on Automatic Detection Algorithm of Plant Invasion Based on Computer Vision,,,,,,,,,,,,,yes,unknown,confirmed,opencode_ai,,AI_SCREENING_V1,,B008,feb7c8a80978b97f3bdcffd7291708e8ac5282301ce06c793247227bc43712be,,
TA_R0159,doi:10.3390/rs10020285,159,An Automatic Random Forest-OBIA Algorithm for Early Weed Mapping between and within Crop Rows Using UAV Imagery,,,,,,,,,,,,,yes,unknown,confirmed,opencode_ai,,AI_SCREENING_V1,,B008,feb7c8a80978b97f3bdcffd7291708e8ac5282301ce06c793247227bc43712be,,
TA_R0160,arxiv:181112709,160,Evaluating Bayesian Deep Learning Methods for Semantic Segmentation,,,,,,,,,,,,,yes,unknown,confirmed,opencode_ai,,AI_SCREENING_V1,,B008,feb7c8a80978b97f3bdcffd7291708e8ac5282301ce06c793247227bc43712be,,
