screening_id,candidate_id,rank,title,decision,decision_confidence,reason_code,reason_note,likely_paper_type,likely_dataset_relationship,named_datasets,agricultural_domain,vision_task,modalities,relevance_yes,relevance_unclear,abstract_available,full_text_available,identity_status,reviewer,model,protocol_version,screened_at,batch_id,source_queue_sha256,supersedes_screening_id,notes
TA_R0121,doi:10.3390/make8020044,121,Improving Ground Cover Crop Fractional Vegetation Mapping via Causality-Based Deep Representation Learning,,,,,,,,,,,,,yes,unknown,confirmed,opencode_ai,,AI_SCREENING_V1,,B007,feb7c8a80978b97f3bdcffd7291708e8ac5282301ce06c793247227bc43712be,,
TA_R0122,doi:10.1016/j.compag.2022.106719,122,Deep learning-based segmentation of multiple species of weeds and corn crop using synthetic and real image datasets,,,,,,,,,,,,,yes,unknown,confirmed,opencode_ai,,AI_SCREENING_V1,,B007,feb7c8a80978b97f3bdcffd7291708e8ac5282301ce06c793247227bc43712be,,
TA_R0123,doi:10.3390/s21113647,123,Review of Weed Detection Methods Based on Computer Vision,,,,,,,,,,,,,yes,unknown,confirmed,opencode_ai,,AI_SCREENING_V1,,B007,feb7c8a80978b97f3bdcffd7291708e8ac5282301ce06c793247227bc43712be,,
TA_R0124,doi:10.1109/icra.2018.8460962,124,Real-Time Semantic Segmentation of Crop and Weed for Precision Agriculture Robots Leveraging Background Knowledge in CNNs,,,,,,,,,,,,,yes,unknown,confirmed,opencode_ai,,AI_SCREENING_V1,,B007,feb7c8a80978b97f3bdcffd7291708e8ac5282301ce06c793247227bc43712be,,
TA_R0125,doi:10.1109/access.2023.3263042,125,FieldPlant: A Dataset of Field Plant Images for Plant Disease Detection and Classification With Deep Learning,,,,,,,,,,,,,yes,unknown,confirmed,opencode_ai,,AI_SCREENING_V1,,B007,feb7c8a80978b97f3bdcffd7291708e8ac5282301ce06c793247227bc43712be,,
TA_R0126,doi:10.3390/plants12081730,126,Low-Cost Hyperspectral Imaging to Detect Drought Stress in High-Throughput Phenotyping,,,,,,,,,,,,,yes,unknown,confirmed,opencode_ai,,AI_SCREENING_V1,,B007,feb7c8a80978b97f3bdcffd7291708e8ac5282301ce06c793247227bc43712be,,
TA_R0127,doi:10.1016/j.aiia.2024.11.005,127,Enhancing crop yield prediction in Senegal using advanced machine learning techniques and synthetic data,,,,,,,,,,,,,yes,unknown,confirmed,opencode_ai,,AI_SCREENING_V1,,B007,feb7c8a80978b97f3bdcffd7291708e8ac5282301ce06c793247227bc43712be,,
TA_R0128,doi:10.1109/icra57147.2024.10610208,128,System Calibration of a Field Phenotyping Robot with Multiple High-Precision Profile Laser Scanners,,,,,,,,,,,,,yes,unknown,confirmed,opencode_ai,,AI_SCREENING_V1,,B007,feb7c8a80978b97f3bdcffd7291708e8ac5282301ce06c793247227bc43712be,,
TA_R0129,doi:10.1109/tits.2023.3300537,129,CMX: Cross-Modal Fusion for RGB-X Semantic Segmentation With Transformers,,,,,,,,,,,,,yes,unknown,confirmed,opencode_ai,,AI_SCREENING_V1,,B007,feb7c8a80978b97f3bdcffd7291708e8ac5282301ce06c793247227bc43712be,,
TA_R0130,arxiv:241100201,130,"YOLO Evolution: A Comprehensive Benchmark and Architectural Review of YOLOv12, YOLO11, and Their Previous Versions",,,,,,,,,,,,,yes,unknown,confirmed,opencode_ai,,AI_SCREENING_V1,,B007,feb7c8a80978b97f3bdcffd7291708e8ac5282301ce06c793247227bc43712be,,
TA_R0131,doi:10.1007/s41064-022-00228-6,131,"UAV LiDAR Metrics for Monitoring Crop Height, Biomass and Nitrogen Uptake: A Case Study on a Winter Wheat Field Trial",,,,,,,,,,,,,yes,unknown,confirmed,opencode_ai,,AI_SCREENING_V1,,B007,feb7c8a80978b97f3bdcffd7291708e8ac5282301ce06c793247227bc43712be,,
TA_R0132,doi:10.1016/j.ecolind.2023.110140,132,RGB vs. Multispectral imagery: Mapping aapa mire plant communities with UAVs,,,,,,,,,,,,,yes,unknown,confirmed,opencode_ai,,AI_SCREENING_V1,,B007,feb7c8a80978b97f3bdcffd7291708e8ac5282301ce06c793247227bc43712be,,
TA_R0133,doi:10.48550/arxiv.2411.11285,133,Zero-Shot Automatic Annotation and Instance Segmentation using LLM-Generated Datasets: Eliminating Field Imaging and Manual Annotation for Deep Learning Model Development,,,,,,,,,,,,,yes,unknown,confirmed,opencode_ai,,AI_SCREENING_V1,,B007,feb7c8a80978b97f3bdcffd7291708e8ac5282301ce06c793247227bc43712be,,
TA_R0134,doi:10.1109/cvprw63382.2024.00503,134,SegFormer3D: an Efficient Transformer for 3D Medical Image Segmentation,,,,,,,,,,,,,yes,unknown,confirmed,opencode_ai,,AI_SCREENING_V1,,B007,feb7c8a80978b97f3bdcffd7291708e8ac5282301ce06c793247227bc43712be,,
TA_R0135,doi:10.1109/iccica67008.2025.11337290,135,Deep Learning Based Weed Control Strategies: A Comprehensive Review,,,,,,,,,,,,,yes,unknown,confirmed,opencode_ai,,AI_SCREENING_V1,,B007,feb7c8a80978b97f3bdcffd7291708e8ac5282301ce06c793247227bc43712be,,
TA_R0136,arxiv:161201474,136,Simple and Scalable Predictive Uncertainty Estimation using Deep Ensembles,,,,,,,,,,,,,yes,unknown,confirmed,opencode_ai,,AI_SCREENING_V1,,B007,feb7c8a80978b97f3bdcffd7291708e8ac5282301ce06c793247227bc43712be,,
TA_R0137,doi:10.3390/rs10111690,137,Deep Learning with Unsupervised Data Labeling for Weed Detection in Line Crops in UAV Images,,,,,,,,,,,,,yes,unknown,confirmed,opencode_ai,,AI_SCREENING_V1,,B007,feb7c8a80978b97f3bdcffd7291708e8ac5282301ce06c793247227bc43712be,,
TA_R0138,doi:10.1016/j.softx.2025.102481,138,Spectral Imaging Deep Learning Mapper - SpecDeepMap: An open-source EnMAP-Box semantic segmentation application for hyper- and multispectral mapping,,,,,,,,,,,,,no,unknown,confirmed,opencode_ai,,AI_SCREENING_V1,,B007,feb7c8a80978b97f3bdcffd7291708e8ac5282301ce06c793247227bc43712be,,
TA_R0139,doi:10.1186/s13007-025-01334-3,139,Deep-learning-ready RGB-depth images of seedling development,,,,,,,,,,,,,yes,unknown,confirmed,opencode_ai,,AI_SCREENING_V1,,B007,feb7c8a80978b97f3bdcffd7291708e8ac5282301ce06c793247227bc43712be,,
TA_R0140,doi:10.1038/s41597-023-02098-y,140,"VegAnn, Vegetation Annotation of multi-crop RGB images acquired under diverse conditions for segmentation",,,,,,,,,,,,,yes,unknown,confirmed,opencode_ai,,AI_SCREENING_V1,,B007,feb7c8a80978b97f3bdcffd7291708e8ac5282301ce06c793247227bc43712be,,
