screening_id,candidate_id,rank,title,decision,decision_confidence,reason_code,reason_note,likely_paper_type,likely_dataset_relationship,named_datasets,agricultural_domain,vision_task,modalities,relevance_yes,relevance_unclear,abstract_available,full_text_available,identity_status,reviewer,model,protocol_version,screened_at,batch_id,source_queue_sha256,supersedes_screening_id,notes
TA_R0271,doi:10.1109/igarss47720.2021.9555143,271,Comparison of Reflectance Calibration Workflows for a UAV-Mounted Multi-Camera Array System,exclude,high,E03_NO_DATASET_RELEVANCE,"Reflectance calibration methods for UAV multispectral camera array; radiometric calibration, not CV dataset",method_paper,does_not_use_dataset,,,,,,,yes,unknown,confirmed,opencode_ai,deepseek-v4-flash-free,AI_SCREENING_V1,2026-07-22T17:52:53Z,B015,feb7c8a80978b97f3bdcffd7291708e8ac5282301ce06c793247227bc43712be,,
TA_R0272,doi:10.1038/s41598-022-17840-6,272,Intelligent yield estimation for tomato crop using SegNet with VGG19 architecture,include,high,I05,"SegNet with VGG19 for tomato fruit detection, localization and counting for yield estimation",method_paper,uses_dataset_experimentally,,tomato;yield_estimation,semantic_segmentation;counting,RGB,semantic_segmentation,,yes,unknown,confirmed,opencode_ai,deepseek-v4-flash-free,AI_SCREENING_V1,2026-07-22T17:52:53Z,B015,feb7c8a80978b97f3bdcffd7291708e8ac5282301ce06c793247227bc43712be,,
TA_R0273,doi:10.1109/cvpr.2016.350,273,The Cityscapes Dataset for Semantic Urban Scene Understanding,exclude,high,E03_NO_DATASET_RELEVANCE,"Cityscapes urban scene dataset; general autonomous driving, not agricultural",dataset_paper,does_not_use_dataset,,,,,,,yes,unknown,confirmed,opencode_ai,deepseek-v4-flash-free,AI_SCREENING_V1,2026-07-22T17:52:53Z,B015,feb7c8a80978b97f3bdcffd7291708e8ac5282301ce06c793247227bc43712be,,
TA_R0274,doi:10.3389/fpls.2018.01933,274,"Plant Phenotyping Research Trends, a Science Mapping Approach",exclude,high,E03_NO_DATASET_RELEVANCE,Bibliometric science mapping of plant phenotyping research; no CV dataset or method,survey_or_review,does_not_use_dataset,,,,,,,yes,unknown,confirmed,opencode_ai,deepseek-v4-flash-free,AI_SCREENING_V1,2026-07-22T17:52:53Z,B015,feb7c8a80978b97f3bdcffd7291708e8ac5282301ce06c793247227bc43712be,,
TA_R0275,doi:10.1109/cvpr46437.2021.01223,275,Prototypical Pseudo Label Denoising and Target Structure Learning for Domain Adaptive Semantic Segmentation,exclude,high,E03_NO_DATASET_RELEVANCE,"Domain adaptive semantic segmentation with prototype denoising; general CV, not agricultural",method_paper,does_not_use_dataset,,,,,,,yes,unknown,confirmed,opencode_ai,deepseek-v4-flash-free,AI_SCREENING_V1,2026-07-22T17:52:53Z,B015,feb7c8a80978b97f3bdcffd7291708e8ac5282301ce06c793247227bc43712be,,
TA_R0276,doi:10.1109/discover62353.2024.10750697,276,SegFormer-Based Approach for Semantic Segmentation of Necrotic Tissues from Histopathology Images,exclude,high,E03_NO_DATASET_RELEVANCE,"SegFormer for necrotic tissue segmentation in histopathology; biomedical, not agricultural",method_paper,does_not_use_dataset,,,,,,,yes,unknown,confirmed,opencode_ai,deepseek-v4-flash-free,AI_SCREENING_V1,2026-07-22T17:52:53Z,B015,feb7c8a80978b97f3bdcffd7291708e8ac5282301ce06c793247227bc43712be,,
TA_R0277,doi:10.1109/cvpr52729.2023.00297,277,Mask DINO: Towards A Unified Transformer-based Framework for Object Detection and Segmentation,exclude,high,E03_NO_DATASET_RELEVANCE,"Mask DINO unified detection/segmentation on COCO/ADE20K; general CV, not agricultural",method_paper,does_not_use_dataset,,,,,,,yes,unknown,confirmed,opencode_ai,deepseek-v4-flash-free,AI_SCREENING_V1,2026-07-22T17:52:53Z,B015,feb7c8a80978b97f3bdcffd7291708e8ac5282301ce06c793247227bc43712be,,
TA_R0278,doi:10.3390/s17092007,278,Novelty Detection Classifiers in Weed Mapping: Silybum marianum Detection on UAV Multispectral Images,include,high,I05,"Novelty detection classifiers (OC-SVM, autoencoders) for Silybum marianum weed mapping on UAV multispectral imagery",method_paper,uses_dataset_experimentally,,weeds;mapping,classification,multispectral;UAV,classification;multispectral;uav;remote_sensing,,yes,unknown,confirmed,opencode_ai,deepseek-v4-flash-free,AI_SCREENING_V1,2026-07-22T17:52:53Z,B015,feb7c8a80978b97f3bdcffd7291708e8ac5282301ce06c793247227bc43712be,,
TA_R0279,doi:10.1109/cvpr52729.2023.00288,279,Side Adapter Network for Open-Vocabulary Semantic Segmentation,exclude,high,E03_NO_DATASET_RELEVANCE,"Side Adapter Network for open-vocabulary semantic segmentation with CLIP; general CV, not agricultural",method_paper,does_not_use_dataset,,,,,,,yes,unknown,confirmed,opencode_ai,deepseek-v4-flash-free,AI_SCREENING_V1,2026-07-22T17:52:53Z,B015,feb7c8a80978b97f3bdcffd7291708e8ac5282301ce06c793247227bc43712be,,
TA_R0280,doi:10.1016/j.asoc.2020.106597,280,Uncertainty quantification for plant disease detection using Bayesian deep learning,include,high,I05;I12,Bayesian deep learning for plant disease detection with uncertainty quantification,method_paper,uses_dataset_experimentally,,plant_disease,classification,RGB,classification;uncertainty,,yes,unknown,confirmed,opencode_ai,deepseek-v4-flash-free,AI_SCREENING_V1,2026-07-22T17:52:53Z,B015,feb7c8a80978b97f3bdcffd7291708e8ac5282301ce06c793247227bc43712be,,Uncertainty quantification in ag-CV context
TA_R0281,doi:10.48550/arxiv.2304.11127,281,Tree-structured Parzen estimator: Understanding its algorithm components and their roles for better empirical performance,exclude,high,E03_NO_DATASET_RELEVANCE,"Tree-structured Parzen estimator for Bayesian hyperparameter optimization; general ML, not agricultural",method_paper,does_not_use_dataset,,,,,,,yes,unknown,confirmed,opencode_ai,deepseek-v4-flash-free,AI_SCREENING_V1,2026-07-22T17:52:53Z,B015,feb7c8a80978b97f3bdcffd7291708e8ac5282301ce06c793247227bc43712be,,
TA_R0282,doi:10.1002/ps.4821,282,The challenge of herbicide resistance around the world: a current summary.,exclude,high,E03_NO_DATASET_RELEVANCE,Review of herbicide resistance around the world; no computer vision,survey_or_review,does_not_use_dataset,,,,,,,yes,unknown,confirmed,opencode_ai,deepseek-v4-flash-free,AI_SCREENING_V1,2026-07-22T17:52:53Z,B015,feb7c8a80978b97f3bdcffd7291708e8ac5282301ce06c793247227bc43712be,,
TA_R0283,doi:10.3390/jof7040283,283,Weeds as Pathogen Hosts and Disease Risk for Crops in the Wake of a Reduced Use of Herbicides: Evidence from Yam (Dioscorea alata) Fields and Colletotrichum Pathogens in the Tropics,exclude,high,E03_NO_DATASET_RELEVANCE,"Weeds as pathogen hosts for Colletotrichum in yam fields; plant pathology, no CV",method_paper,does_not_use_dataset,,,,,,,yes,unknown,confirmed,opencode_ai,deepseek-v4-flash-free,AI_SCREENING_V1,2026-07-22T17:52:53Z,B015,feb7c8a80978b97f3bdcffd7291708e8ac5282301ce06c793247227bc43712be,,
TA_R0284,doi:10.1109/iccv48922.2021.00986,284,Swin Transformer: Hierarchical Vision Transformer using Shifted Windows,exclude,high,E03_NO_DATASET_RELEVANCE,Swin Transformer general-purpose vision backbone on ImageNet/COCO/ADE20K; not agricultural,method_paper,does_not_use_dataset,,,,,,,yes,unknown,confirmed,opencode_ai,deepseek-v4-flash-free,AI_SCREENING_V1,2026-07-22T17:52:53Z,B015,feb7c8a80978b97f3bdcffd7291708e8ac5282301ce06c793247227bc43712be,,
TA_R0285,doi:10.3389/fpls.2016.01419,285,Using Deep Learning for Image-Based Plant Disease Detection,include,high,I05,"Deep CNN for plant disease detection on PlantVillage dataset (54K images, 14 species, 26 diseases)",method_paper,uses_dataset_experimentally,PlantVillage,plant_disease,classification,RGB,classification,,yes,unknown,confirmed,opencode_ai,deepseek-v4-flash-free,AI_SCREENING_V1,2026-07-22T17:52:53Z,B015,feb7c8a80978b97f3bdcffd7291708e8ac5282301ce06c793247227bc43712be,,
TA_R0286,doi:10.1146/annurev-arplant-042809-112119,286,Evolution in Action: Plants Resistant to Herbicides,exclude,high,E03_NO_DATASET_RELEVANCE,"Review of herbicide resistance evolution in plants; molecular biology, no CV",survey_or_review,does_not_use_dataset,,,,,,,yes,unknown,confirmed,opencode_ai,deepseek-v4-flash-free,AI_SCREENING_V1,2026-07-22T17:52:53Z,B015,feb7c8a80978b97f3bdcffd7291708e8ac5282301ce06c793247227bc43712be,,
TA_R0287,doi:10.3390/rs17193367,287,LMVMamba: A Hybrid U-Shape Mamba for Remote Sensing Segmentation with Adaptation Fine-Tuning,exclude,high,E03_NO_DATASET_RELEVANCE,"LMVMamba for remote sensing semantic segmentation; general RS, not agriculture-specific",method_paper,does_not_use_dataset,,,,,,,yes,unknown,confirmed,opencode_ai,deepseek-v4-flash-free,AI_SCREENING_V1,2026-07-22T17:52:53Z,B015,feb7c8a80978b97f3bdcffd7291708e8ac5282301ce06c793247227bc43712be,,
TA_R0288,doi:10.3390/agriculture12101554,288,Sustainable Agro-Food Systems for Addressing Climate Change and Food Security,exclude,high,E03_NO_DATASET_RELEVANCE,Review of sustainable agro-food systems and food security; no computer vision,survey_or_review,does_not_use_dataset,,,,,,,yes,unknown,confirmed,opencode_ai,deepseek-v4-flash-free,AI_SCREENING_V1,2026-07-22T17:52:53Z,B015,feb7c8a80978b97f3bdcffd7291708e8ac5282301ce06c793247227bc43712be,,
TA_R0289,doi:10.3390/agronomy14061178,289,HPPEM: A High-Precision Blueberry Cluster Phenotype Extraction Model Based on Hybrid Task Cascade,include,high,I05,Blueberry cluster phenotype extraction using HTC instance segmentation with ConvNeXt backbone,method_paper,uses_dataset_experimentally,,blueberry;phenotyping,instance_segmentation,RGB,instance_segmentation;phenotyping,,yes,unknown,confirmed,opencode_ai,deepseek-v4-flash-free,AI_SCREENING_V1,2026-07-22T17:52:53Z,B015,feb7c8a80978b97f3bdcffd7291708e8ac5282301ce06c793247227bc43712be,,
TA_R0290,doi:10.3920/978-90-8686-947-3_62,290,Automatic estimation of trunk cross sectional area using deep learning,include,high,I05;I06,Apple trunk cross-sectional area estimation using RGB-D and Mask2Former segmentation with 3D point cloud,method_paper,uses_dataset_experimentally,,apple;orchard,instance_segmentation,RGB;depth_or_rgbd;3d,instance_segmentation;3d_vision;depth_or_rgbd,,yes,unknown,confirmed,opencode_ai,deepseek-v4-flash-free,AI_SCREENING_V1,2026-07-22T17:52:53Z,B015,feb7c8a80978b97f3bdcffd7291708e8ac5282301ce06c793247227bc43712be,,
