screening_rank,canonical_paper_id,priority_score,priority_components,title,year,publication_date,authors,venue,journal,doi,arxiv_id,pmid,pmcid,landing_url,pdf_url,is_open_access,max_provider_citation_count,max_provider_reference_count,providers,provider_ids,seed_ids,dataset_names,directions,provider_edge_rows,abstract,title_abstract_decision,full_text_decision,paper_role,actual_dataset_use,dataset_use_evidence,exclusion_reason,reviewer,reviewed_date,notes
18,doi:10.1002/ppj2.70083,17.0,forward:+4; year>=2024:+3; keywords:+10,Pixel‐level supervision resolves overlap: Benchmarking YOLOv12 segmentation for accurate multi‐cluster dry bean stand counting from time series unoccupied aerial systems imagery,2026,2026-05-11,Aliasghar Bazrafkan; Valerio Hoyos‐Villegas,The Plant Phenome Journal,Wiley,10.1002/ppj2.70083,,,,https://doi.org/10.1002/ppj2.70083,,True,0,40,openalex,openalex:W7160857378,P001,MuST-C,forward_citation,1,"Abstract An agronomic trait such as stand count is important for cultivar development and crop management practices. Manually counting the number of plants is time consuming, labor‐intensive, and prone to error. The use of unoccupied aerial systems (UAS)‐collected red, green, blue (RGB) imagery in conjunction with advanced deep learning and image processing methods might serve as an accurate, reliable, and affordable alternative to manual stand counting. This paper presents a thresholding framework for high‐accuracy stand counting in dry beans and comparing it with the performance of the newest YOLO12 detection and segmentation models on a time series UAS RGB dataset and converting the findings into an easy‐to‐use web application. The methodology involved collecting multiyear RGB data, developing a custom ArcGIS Python library pipeline for YOLO (you only look once)‐compatible dataset unification, and comparing three distinct counting approaches. Results demonstrated the clear superiority of the deep learning segmentation architecture. While the thresholding method provided a reliable baseline ( R 2 = 0.922), the YOLOv12 segmentation model achieved a robust R 2 of 0.972 with a significantly lower mean absolute error of 3.2 and an mAP50 of 0.941 (where mAP is mean average precision). In contrast, the YOLOv12 segmentation model, leveraging pixel‐level supervision and a multi‐class structure to resolve overlapping plant clusters, achieved a robust coefficient of determination ( R 2 = 0.972) with minimal bias. This high performance, attained using only affordable RGB imagery, validates the use of low‐cost sensors for precision phenotyping. The framework was contained in a Flask web application that provides nontechnical users direct access to the high‐accuracy model and generates georeferenced outputs, effectively bridging the gap between research and practical decision‐support tools for dry bean breeders and growers.",,,,,,,,,
19,arxiv:260503784,17.0,forward:+4; year>=2024:+3; keywords:+10,ReLeaf: Benchmarking Leaf Segmentation across Domains and Species,2026,2026-05-05,Robert Martinko; Daniel Steininger; Julia Simon; A. Trondl; M. Blaickner,,,,2605.03784,,,https://www.semanticscholar.org/paper/5327bccd2698cf347bdb8ffd31a32d62d836cb17,,False,0,42,semantic_scholar,semantic_scholar:5327bccd2698cf347bdb8ffd31a32d62d836cb17,P010,WeedsGalore,forward_citation,1,"Rising global food demand and growing climate pressure increase the need for sustainable, precise agricultural practices. Automated, individualized plant treatment relies on fine-grained visual analysis, yet leaf-level segmentation remains underexplored despite its value for assessing crop health, growth dynamics, yield potential and localized stress symptoms. Progress is limited by a lack of dedicated datasets, especially regarding species coverage, and by the absence of systematic evaluations of modern instance-segmentation architectures for this task. We address these gaps by surveying current data and identifying four suitable, publicly available leaf-segmentation datasets. Using them, we compare one-stage, two-stage and Transformer-based detectors and identify a YOLO26 model configuration to provide the best trade-off for real-world precision-agriculture tasks. Extensive cross-domain generalization experiments reveal substantial performance drops across plant species and recording setups, especially for models trained solely on laboratory data. To strengthen data availability, we introduce a new benchmark dataset with leaf-level masks for 23 plant species, created via semi-automatic annotation of selected CropAndWeed images. A model trained on all four existing datasets achieves a mean mAP50-95 of 83.9% across their corresponding test sets and 40.2% on our new benchmark, demonstrating improved generalization and highlighting the need for diverse leaf-segmentation datasets in robust precision agriculture.",,,,,,,,,
20,doi:10.1109/tgrs.2026.3690653,17.0,forward:+4; year>=2024:+3; keywords:+10,RPD: Learning Efficient Crops and Weeds for Field Semantic Segmentation in Drone Images,2026,,Fanghui Chen; Zhenchao Yang; Fengyuan Ren,IEEE Transactions on Geoscience and Remote Sensing,"IEEE Transactions on Geoscience and Remote Sensing, 64, 4408613-4408613",10.1109/tgrs.2026.3690653,,,,https://www.semanticscholar.org/paper/8193ae2126742a18444efe193a8852d726405f58,,False,0,51,semantic_scholar,semantic_scholar:8193ae2126742a18444efe193a8852d726405f58,P010,WeedsGalore,forward_citation,1,"Efficient crop-weed segmentation is crucial for the perception needs of agricultural drones. However, natural illumination variations significantly alter the visual appearance of plants and pose major challenges for accurate crop-weed segmentation in field environments, particularly for small weeds. Existing deep learning (DL)-based methods mainly emphasize high-level semantic representations and may struggle to capture fine-grained structural cues essential for distinguishing weeds from crops. Meanwhile, these methods often demand high computational resources, limiting their practicality in resource-constrained field environments. To this end, we propose an efficient crop-weed semantic segmentation method based on a lightweight reparameterized pixel difference (RPD) block. The RPD block integrates pixel difference convolutions (PDCs) in a parallel multibranch structure to capture local structural differences that are robust to illumination variations, while utilizing reparameterization techniques to improve inference efficiency. Built upon this block, RPD-Net is an end-to-end network with strong modeling capacity and a lightweight structure for in-field crop-weed segmentation. Extensive experiments on the drone-acquired public datasets validate the effectiveness of our method. Trained from scratch, our method achieves approximately 70 intersection-over-union (IoU) on the challenging weed segmentation task of the Phenobench dataset. Latency evaluations across multiple hardware platforms show that RPD-Net runs 42 FPS on an RTX 3090 and 7 FPS on a Jetson TX2. Compared to state-of-the-art (SOTA) methods, RPD-Net offers a better tradeoff between segmentation accuracy and computational efficiency. Additional experiments on the CoFly dataset further validate the generalization ability of RPD-Net. The code is available at https://github.com/chenfh21/RPD-Net",,,,,,,,,
21,doi:10.1016/j.atech.2026.101875,17.0,forward:+4; year>=2024:+3; keywords:+10,Unveiling the hidden: Early detection of invasive vegetation in crops with UAV multispectral imaging,2026,2026-02-24,Henry O. Velesaca; Andrea Mero; Héctor Villegas; Ángel D. Sappa,Smart Agricultural Technology,Elsevier BV,10.1016/j.atech.2026.101875,,,,https://doi.org/10.1016/j.atech.2026.101875,,True,0,43,openalex,openalex:W7131279357,P010,WeedsGalore,forward_citation,1,"This work presents a practical framework for early detection of camouflaged weeds in agricultural production environments using UAV-based near-infrared (NIR) imagery. The proposed approach integrates RGB-NIR image fusion with advanced camouflaged object detection (COD) models to support precision agriculture applications at farm scale. Fourteen state-of-the-art (SOTA) fusion techniques are evaluated, and the three best-performing methods are selected for multispectral integration, while nine SOTA COD models are trained and tested on RGB and RGB-NIR fused data. Experimental validation on two UAV-based case studies–a commercial banana plantation (Weeds-Banana) and a maize field (WeedsGalore)–demonstrates that RGB-NIR fusion consistently improves weed segmentation accuracy compared with RGB-only inputs. Overall, the proposed framework provides a transferable and application-oriented solution for weed detection, enabling targeted interventions and contributing to reduced herbicide use and more sustainable crop management. The dataset is publicly available at GitHub: https://cod-espol.github.io/COD-Weeds/ .",,,,,,,,,
22,doi:10.15625/vap.2026.0019,17.0,forward:+4; year>=2024:+3; keywords:+10,A Preliminary Study on U-Net for Crop Monitoring Using Low-Altitude Drone Imagery,2025,2025-12-14,Pham Manh Thang; Hoang-Vu Truong; Hoang Van Manh; Do Nam; D. Viet,"Proceedings of the 8th International Conference on Engineering Mechanics and Automation ICEMA 2025 20th Anniversary of the Faculty of Engineering Mechanics and Automation, University of Engineering and Technology, Vietnam National University, Hanoi","Proceedings of the 8th International Conference on Engineering Mechanics and Automation ICEMA 2025 20th Anniversary of the Faculty of Engineering Mechanics and Automation, University of Engineering and Technology, Vietnam National University, Hanoi",10.15625/vap.2026.0019,,,,https://www.semanticscholar.org/paper/4a8dc42d0dfeb1d1c85dd23fcff1b5aba431ac0b,,False,0,18,semantic_scholar,semantic_scholar:4a8dc42d0dfeb1d1c85dd23fcff1b5aba431ac0b,P010,WeedsGalore,forward_citation,1,"—Crop growth monitoring is crucial for precision agriculture, yet traditional methods lack scalability and accuracy. This study develops and evaluates lightweight deep learning architectures for semantic segmentation of weeds, crops, and bare soil from low-altitude multispectral UAV imagery. We systematically compared four U-Net based variants: standard U-Net, Attention enhanced, ResNet augmented, and a proposed SCSE embedded version, against the DeepLabV3+ benchmark on the standardized WeedsGalore dataset. The central hypothesis was that optimized U-Net architectures could match the accuracy of DeepLabV3+ while being substantially more efficient. Results support this: enhanced variants achieved mean Intersection-over-Union (mIoU) values close to DeepLabV3+, with the attention-based model reducing parameter size by 21.1% and maintaining nearly equivalent accuracy. The developed ResUNet SCSE performed best in weed segmentation, reaching an IoU of 77.49% for the weed class. Both improved models also showed the lowest Expected Calibration Error (0.0019), demonstrating improved reliability in uncertainty estimation. Overall, the findings highlight the viability of optimized U-Net architectures for deployment on resource-constrained UAV platforms, offering an favorable trade-off between segmentation accuracy and computational efficiency for automated agricultural monitoring.",,,,,,,,,
23,doi:10.1109/cict67193.2025.11399080,17.0,forward:+4; year>=2024:+3; keywords:+10,"AgriSeg: A Comprehensive Study on Semantic Segmentation for Leaf Disease, Fruit, and Crop-Weed Detection",2025,2025-12-19,Udaybhan Rathore; Rupesh Kumar; Amit Shakya; Shruti S. Phutke; Lalit Sharma,Conference Information and Communication Technology,"2025 IEEE 9th International Conference on Information and Communication Technology (CICT), 1-6",10.1109/cict67193.2025.11399080,,,,https://www.semanticscholar.org/paper/d721b920695e3b07157a0cb752b604ccc3d8a6a1,,False,0,60,openalex; semantic_scholar,openalex:W7131231661; semantic_scholar:d721b920695e3b07157a0cb752b604ccc3d8a6a1,P011,PlantSeg,forward_citation,2,"The agricultural sector is a cornerstone to global economic growth, food security, and employment. With the rise of Artificial Intelligence, it is transforming precision agriculture by enabling smart solutions that optimize farming, reduce resource waste, and enhance productivity. In this context, semantic segmentation plays a crucial role majorly in three key agricultural tasks: disease segmentation to prevent the spread of infections, fruit segmentation for efficient harvesting and food management, and crop-weed segmentation for crop and resource management. Despite progress in deep learning-based segmentation, agriculture research continues to rely on conventional models and controlled-environment datasets, limiting our understanding of how recent architectural advancements across domains impact real-world agricultural scenarios. To address these challenges, we introduce AgriSeg, a research effort aimed at tackling issues related to global food dependency and food waste. This work also establishes a new benchmark milestone for semantic segmentation in diverse agricultural tasks, including leaf disease, fruit, and crop–weed segmentation, across five real-world datasets: NLB, LDSD, MinneApple, WGISD, and CWFID. To ensure a fair comparison, we evaluate widely adopted agriculture models such as DeepLabv3+ and SegNeXt, the best-performing agriculture-specific model PD-SegNet, as well as state-of-the-art models from general vision domains like InternImage and Meta-Prompts, to comprehensively analyze their effectiveness across diverse agricultural scenarios.",,,,,,,,,
24,doi:10.1109/aict67988.2025.11268618,17.0,forward:+4; year>=2024:+3; keywords:+10,Residual-Enhanced YOLO with Motion-Blur Augmentation for UAV-Based Weed Detection,2025,2025-10-29,Jamil Ahmad; Sara Mahmoud; Mohamed Mahmoud; Lama Elfateh; Mustaqeem Khan,Advanced Industrial Conference on Telecommunications,"2025 IEEE 19th International Conference on Application of Information and Communication Technologies (AICT), 1-5",10.1109/aict67988.2025.11268618,,,,https://www.semanticscholar.org/paper/3d0420b720ad7551308687d063754bdd5d2123a3,,False,0,22,openalex; semantic_scholar,openalex:W4417131419; semantic_scholar:3d0420b720ad7551308687d063754bdd5d2123a3,P010,WeedsGalore,forward_citation,2,"Unmanned Aerial Vehicles (UAVs) combined with deep learning models have transformed weed detection in precision agriculture, yet challenges remain in adapting to field variability, limited datasets, and motion blur from UAV flight. While CNNs and Transformer-based methods achieve high accuracy, their deployment often struggles with real-time constraints. YOLO architectures, by contrast, offer a strong balance between inference speed and detection accuracy, making them suitable for in-field use. In this paper, we propose YOLO-Res, a residual-skip enhanced YOLO model tailored for UAV-based weed detection in maize fields under true field conditions. The model incorporates motion-blur augmentation during training to simulate UAV-induced artifacts and leverages residual connections to strengthen feature propagation across scales, thereby improving robustness to degraded inputs. Evaluations on the WeedsGalore dataset demonstrate that YOLO-Res consistently outperforms baseline YOLO variants, achieving superior detection accuracy even under severe blur and varying crop–weed densities, while maintaining real-time inference capability.",,,,,,,,,
25,doi:10.1016/j.biosystemseng.2025.104147,16.903,forward:+4; backward:+1; year>=2024:+3; keywords:+8; citations:+0.90,3D plant segmentation: Comparing a 2D-to-3D segmentation method with state-of-the-art 3D segmentation algorithms,2025,2025-04-17,Bart M. van Marrewijk; Tim van Daalen; Bolai Xin; E. V. van Henten; G. Polder; Gert Kootstra,Biosystems Engineering,Biosystems Engineering,10.1016/j.biosystemseng.2025.104147,,,,https://www.semanticscholar.org/paper/cf29635c8ec105979f7e6b5c825940f6e324138a,https://doi.org/10.1016/j.biosystemseng.2025.104147,True,7,58,openalex; semantic_scholar,openalex:W4409537321; semantic_scholar:cf29635c8ec105979f7e6b5c825940f6e324138a,P009,TomatoWUR,backward_reference; forward_citation,3,"Plant measurements are crucial to determine which plants grow optimal under certain conditions. These measurements can be done by hand, or automated using cameras, also known as image-based plant phenotyping. These images can be used to create point clouds to measure plant traits in 3D. To extract plant traits, accurate segmentation is crucial. Most point cloud segmentation methods rely on 3D segmentation algorithms. These algorithms are not as advanced and developed as 2D algorithms. In addition, 2D neural networks are pre-trained on large diverse datasets. In our work, it was therefore hypothesised that segmentation of point clouds using projection-based methods can obtain a higher accuracy than voxel or point-based algorithms. To test this hypothesis, a 2D-to-3D reprojection method was developed and compared with three state-of-the-art 3D segmentation algorithms; Swin3D-s, Point Transformer v3 and MinkUNet34C. The 2D-to-3D method segmented images using Mask2Former, reprojected the predictions to the point cloud, and used a majority vote algorithm to merge multiple predictions. All algorithms were trained and tested to segment 3D point clouds into leaves, main stem, side stem, and pole. There was no significant difference between the 2D-to-3D, Swin3D-s and Point Transformer v3 algorithm, indicating that state-of-the-art voxel or point-based methods perform similar than our projection-based method. However, the 2D-to-3D method had a higher performance by including virtual cameras and it had a higher training efficiency. With only five annotated plants, a similar performance was obtained than training Swin3D-s on 25 plants indicating the added value of the developed pipeline.",,,,,,,,,
