screening_rank,canonical_paper_id,priority_score,priority_components,title,year,publication_date,authors,venue,journal,doi,arxiv_id,pmid,pmcid,landing_url,pdf_url,is_open_access,max_provider_citation_count,max_provider_reference_count,providers,provider_ids,seed_ids,dataset_names,directions,provider_edge_rows,abstract,title_abstract_decision,full_text_decision,paper_role,actual_dataset_use,dataset_use_evidence,exclusion_reason,reviewer,reviewed_date,notes
8,arxiv:260522034,17.301,forward:+4; year>=2024:+3; keywords:+10; citations:+0.30,AgroVG: A Large-Scale Multi-Source Benchmark for Agricultural Visual Grounding,2026,2026-05-21,Haochen Li; Juepeng Zheng; Zenghao Yang; Kaiqi Du; Guilong Xiao; Gengmeng Pu; Haohuan Fu; Jianxi Huang,,,,2605.22034,,,https://www.semanticscholar.org/paper/ddd769f8e948376dbefcfe3959c171960eadc2cc,,False,1,60,semantic_scholar,semantic_scholar:ddd769f8e948376dbefcfe3959c171960eadc2cc,P011,PlantSeg,forward_citation,1,"Visual grounding, the task of localizing objects described by natural-language expressions, is a foundational capability for agricultural AI systems, enabling applications such as selective weeding, disease monitoring, and targeted harvesting. Reliable evaluation of agricultural visual grounding remains challenging because agricultural targets are often small, repetitive, occluded, or irregularly shaped, and instructions may refer to one, many, or no objects in an image. Evaluating this capability therefore requires jointly testing localization accuracy, target-set completeness, and existence-aware abstention. To address these challenges, we introduce \textbf{AgroVG}, a multi-source benchmark that formulates agricultural grounding as generalized set prediction: given an image and a referring expression, a model must return all matching target instances or abstain when no target is present. AgroVG contains 10{,}071 annotation-grounded image-query pairs from ten source datasets across six target families: crop/weed, fruit, wheat head, pest, plant disease, and tree canopy. It supports bounding-box grounding (T1) across all six families and instance-mask grounding (T2) on sources with reliable instance-level pixel annotations, with queries covering single-target, multi-target, and target-absent regimes. AgroVG further provides task-specific protocols for box-set matching and query-level mask coverage. Zero-shot evaluation of 26 model configurations spanning closed-source MLLMs, open-source VLMs, and specialized grounding systems reveals persistent gaps: the best multi-target Set-$F_1$ reaches only 0.35, and the best positive-query mask success rate at IoU@0.75 remains below 0.17. Data and code are available at https://anonymous.4open.science/r/AgroVG-5172/ .",,,,,,,,,
9,doi:10.3389/fpls.2026.1761249,17.301,forward:+4; year>=2024:+3; keywords:+10; citations:+0.30,PTV2-Fr: a point cloud segmentation network for phenotypic trait extraction and gibberellin effect analysis in sorghum seedlings,2026,2026-02-19,Junyi Li; Yunqi Shao; Luxu Tian; Ziyi Zhang; Yurong Guo; Zhibo Zhong; Ruxiao Bai; Peng Yang; Feng Pan; Xiuqing Fu,Frontiers in Plant Science,"Frontiers in Plant Science, 17",10.3389/fpls.2026.1761249,,41799987,12961441,https://www.semanticscholar.org/paper/082843169131f92a0d697999b24e496578615735,,False,1,44,semantic_scholar,semantic_scholar:082843169131f92a0d697999b24e496578615735,P006,Annotated 3D Point Cloud Dataset of Broad-Leaf Legumes,forward_citation,1,"Sorghum is a globally important crop. Under the breeding goals of high yield and stress resistance, the precise selection of elite germplasm is crucial. Phenotypic parameters such as plant height and leaf area at the seedling stage are core indicators for evaluating growth vitality. However, traditional manual measurement is inefficient and error-prone, making it difficult to meet the needs of high-throughput research. To address this, this study proposes an improved model (PTV2-Fr) based on Point Transformer V2 (PTV2), which combines 3D point cloud technology to realize the automatic extraction of sorghum seedling phenotypic parameters and explores the regulatory effects of different gibberellin (GA3) concentrations. In this study, videos of sorghum seedlings were collected using the relevant system of Nanjing Agricultural University, and reconstructed into.ply format 3D point cloud files via the open-source software Colmap. The core optimizations of the PTV2-Fr model are as follows: Firstly, it proposes a Multi-Radius Dual-Coordinate Attention (MRDCA) mechanism to address the problems of leaf overlap and uneven point cloud density, thereby enhancing feature discrimination ability; Secondly, it introduces a Point-Graph Invariant Feature Refinement (PG-InvFR) module to improve the sensitivity of the segmentation head to local geometric details; Thirdly, it constructs a composite loss function (EL Loss) combining class-weighted cross-entropy loss and Lovász loss to alleviate class imbalance and boost segmentation accuracy. We selected 50 valid datasets from 112 video groups, annotated into three categories: Stem, Leaf, and Pot. The results show that PTV2-Fr outperforms PTV2 by 2.5% in accuracy, with significant improvements in Recall and mean F1-score (mF1). Ablation experiments confirm the positive effects of MRDCA, PG-InvFR, and EL Loss. Furthermore, PTV2-Fr demonstrates good robustness in analyzing GA concentrations, revealing that 50–100 mg/L GA concentrations promote seedling growth, while concentrations exceeding 200 mg/L inhibit growth. The PTV2-Fr model provides an efficient solution for the automatic determination of sorghum seedling phenotypes, and the revealed GA3 regulatory mechanism can offer theoretical references for high-quality seedling cultivation and hormone management.",,,,,,,,,
10,doi:10.3390/robotics15040081,17.301,forward:+4; year>=2024:+3; keywords:+10; citations:+0.30,"Robotics in Precision Agriculture: Task-, Platform-, and Evaluation-Oriented Review",2026,2026-04-20,Natheer Almtireen; Mutaz Ryalat,Robotics,Multidisciplinary Digital Publishing Institute,10.3390/robotics15040081,,,,https://doi.org/10.3390/robotics15040081,,True,1,123,openalex,openalex:W7154939536,P003,AgriVision,forward_citation,1,"Robotics is increasingly positioned as an enabling technology for precision agriculture, where management actions must be spatially and temporally targeted under constraints on labour, input use, safety, and environmental impact. This review synthesises studies on agricultural field robotics and organises the literature along four complementary axes: task (monitoring, weeding, spraying, and harvesting), platform (UGV, UAV, gantry/fixed-structure, greenhouse robot, and hybrid systems), autonomy-stack module (perception, localisation, planning, control, actuation, safety, and human–robot interaction), and evaluation setting (lab, greenhouse, open-field single season, and open-field multi-season/multi-site). Across these dimensions, this review analyses how platform constraints shape sensing geometry, actuation capability, localisation reliability, energy/endurance, supervision burden, and safety requirements. It further examines enabling technologies that recur across tasks, including vision and multimodal perception under occlusion and illumination variability, localisation and mapping under weak or denied GNSS, uncertainty-aware planning in deformable and partially observed environments, and compliant end-effectors for contact-rich operations. Beyond cataloguing systems, this paper emphasises evaluation practice by synthesising core task-relevant metrics, comparing laboratory and field validation settings, and proposing a reporting checklist and benchmark ladder to improve reproducibility and cross-study comparability. This review identifies recurring bottlenecks in domain shift, long-term autonomy, calibration robustness, crop-safe actuation, and safety assurance near humans, and it concludes with a staged research roadmap linking near-term evaluation reform to longer-term credible multi-site autonomy. Overall, this paper provides a structured framework for interpreting agricultural robotic systems not only by application but also by deployment context, system maturity, and evaluation credibility.",,,,,,,,,
11,doi:10.1109/iccvw69036.2025.00742,17.301,forward:+4; year>=2024:+3; keywords:+10; citations:+0.30,Decoder-Aware Self-Supervised Continual Pretraining and Uncertainty-Guided Pseudo-Labeling for Wheat Organ Segmentation,2025,2025-10-19,Tapotosh Ghosh; Md. Jaber Al Nahian; Farnaz Sheikhi; Farhad Maleki,2025 IEEE/CVF International Conference on Computer Vision Workshops (ICCVW),"2025 IEEE/CVF International Conference on Computer Vision Workshops (ICCVW), 3516-3526",10.1109/iccvw69036.2025.00742,,,,https://www.semanticscholar.org/paper/5288e4b4b8fc6092d803b675d9de728956dbe9d3,,False,1,52,openalex; semantic_scholar,openalex:W7131133125; semantic_scholar:5288e4b4b8fc6092d803b675d9de728956dbe9d3,P011,PlantSeg,forward_citation,2,"Accurate segmentation of wheat organs—spikes, leaves, and stems—is critical for plant phenotyping but remains a challenge due to domain variability and limited labeled data. In this work, we propose a label-efficient segmentation framework that utilizes only 99 labeled samples from the GWFSS dataset. Our approach begins with a continual decoder-aware pretraining (DeCon-ML), where a ConvNeXt-L encoder (initialized with ImageNet1K weights) is paired with a Feature Pyramid Network (FPN) decoder and pretrained on 64,368 unlabeled wheat images in two stages: training the decoder while keeping the encoder frozen, followed by joint encoder-decoder pre-training. For fine-tuning, we train ConvNeXt-L models on the labeled set with 99 samples, initialized with ImageNet- 1K and GWFSS-pretrained weights, and ensemble them to leverage complementary representations. We further enhance generalization by incorporating pseudo-labels, chosen based on feature-space similarity to the labeled set and filtering out low-confidence predictions through uncertainty estimation. We also incorporate a BEiT-L model trained only on the training set and ensembled with ConvNext-L models to achieve our best results. Our proposed approach achieves a mean Intersection over Union (mIoU) of 73.61 and 67.88, respectively, on the validation and test set of the GWFSS dataset, effectively segmenting all four classes (spikes, leaves, stems, background) under varying conditions. This study demonstrates how combining continual pretraining, similarity-aware candidate selection and uncertainty-guided pseudo-labeling can significantly improve semantic segmentation with minimal supervision in agricultural vision. Code is available at https://github.com/tapu1996/DeCon-UGPL-GWFSS.",,,,,,,,,
12,doi:10.1002/ps.70881,17.0,forward:+4; year>=2024:+3; keywords:+10,<scp>ASVLB</scp> ‐Net: A lightweight network for multispectral weed segmentation with <scp>NDVI</scp> ‐guided adaptive fusion,2026,2026-05-05,Zhengtong Dong; Zhenhua Mu; Jie Ji; Chuanming Song; Jianjun Wang; Zumin Wang,Pest Management Science,Wiley,10.1002/ps.70881,,42087361,,https://doi.org/10.1002/ps.70881,,False,0,36,openalex,openalex:W7160444453,P010,WeedsGalore,forward_citation,1,"BACKGROUND: Accurate crop-weed segmentation is critical for precision spraying but is hindered by visual similarity and occlusion. This study aims to develop a lightweight yet high-accuracy multispectral segmentation network to address these challenges. RESULTS: We propose ASVLB-Net, a novel lightweight multiscale feature extraction network guided by normalized difference vegetation index (NDVI) priors for crop-weed segmentation in multispectral imagery. First, we design the Adaptive Spectral-Vegetation Fusion (ASVF) module at the input stage. It achieves adaptive allocation of spectral and spatial features, enhancing the discriminability of vegetation regions. Additionally, we adopt a U-shaped architecture based on the Layer-wise Concatenated Multi-Scale Feature (LCMF) encoder. It efficiently extracts fine-grained features and boundary information with low computational cost. Finally, we use the Bottleneck -SCSA (Spatial and Channel Synergistic Attention) module to capture long-range dependencies, improving segmentation in overlapping areas. Experimental results demonstrate that ASVLB-Net achieves a mean intersection over union (mIOU) of 86.5% and a mean precision of 91.89%, outperforming several state-of-the-art (SOTA) models, while maintaining high efficiency with only 0.47 million parameters. CONCLUSION: The ASVLB-Net significantly improves segmentation accuracy and robustness in unmanned aerial vehicle (UAV) multispectral imagery, offering a robust solution for precision weeding applications. © 2026 Society of Chemical Industry.",,,,,,,,,
13,doi:10.3390/jimaging12050192,17.0,forward:+4; year>=2024:+3; keywords:+10,Automatic Polygon Annotation of Plant Objects for Training Dataset Preparation in Green Biomass Segmentation Tasks,2026,2026-04-30,Evgeniy Ivliev; Valery Gvindjiliya; Danila Donskoy; Yevgeniy Chayka,Journal of Imaging,Multidisciplinary Digital Publishing Institute,10.3390/jimaging12050192,,42188229,13207801,https://www.semanticscholar.org/paper/07daacea6d8747ebf9e31827a01ce43777c5ab78,https://doi.org/10.3390/jimaging12050192,True,0,27,openalex; semantic_scholar,openalex:W7160114587; semantic_scholar:07daacea6d8747ebf9e31827a01ce43777c5ab78,P010,WeedsGalore,forward_citation,2,"This paper addresses the problem of automated segmentation of plant green biomass in field crop images aimed at improving the accuracy of crop and weed identification. To construct a training dataset for neural network models, an automatic annotation algorithm is proposed, enabling the generation of polygonal object masks without human intervention. The method is based on adaptive analysis of color characteristics of plant fragments with iterative narrowing of the hue range in the HSV color space, combined with an integral quality metric that accounts for the dynamics of contour area and shape. The proposed method achieved an IoU of 93.22% and a DSC of 96.30%, demonstrating a high level of agreement between automatic and manual annotations. The generated masks are used to train segmentation models of the YOLO11-seg family. Models of different scales (n, s, m, l, x) were trained and evaluated using standard metrics, including Intersection over Union (IoU), mAP@0.5, mAP@0.5-0.95, F1-score, and Precision-Recall (PR) curves. Experimental results demonstrate that models trained on automatically generated annotations achieve stable segmentation performance of plant green biomass. The best results were obtained with the YOLO11m-seg model, achieving an F1-score of 0. 772. The results confirm the effectiveness of the proposed approach and demonstrate acceptable segmentation quality, supported by both quantitative metrics and visual analysis. The developed automatic annotation algorithm can be used to expand training datasets in computer vision tasks for agricultural applications.",,,,,,,,,
14,doi:10.48550/arxiv.2603.29941,17.0,forward:+4; year>=2024:+3; keywords:+10,Better than Average: Spatially-Aware Aggregation of Segmentation Uncertainty Improves Downstream Performance,2026,2026-03-31,V. E. Guarino; Claudia Winklmayr; Jannik Franzen; J. L. Rumberger; Manuel Pfeuffer; Sonja Greven; K. Maier-Hein; Carsten T. Lüth; Christoph Karg; Dagmar Kainmueller,arXiv.org,"ArXiv, abs/2603.29941",10.48550/arxiv.2603.29941,2603.29941,,,https://www.semanticscholar.org/paper/21bb374dc1576f6fddb1dc15b4aad128ca1f8a65,,False,0,81,semantic_scholar,semantic_scholar:21bb374dc1576f6fddb1dc15b4aad128ca1f8a65,P010,WeedsGalore,forward_citation,1,"Uncertainty Quantification (UQ) is crucial for ensuring the reliability of automated image segmentations in safety-critical domains like biomedical image analysis or autonomous driving. In segmentation, UQ generates pixel-wise uncertainty scores that must be aggregated into image-level scores for downstream tasks like Out-of-Distribution (OoD) or failure detection. Despite routine use of aggregation strategies, their properties and impact on downstream task performance have not yet been comprehensively studied. Global Average is the default choice, yet it does not account for spatial and structural features of segmentation uncertainty. Alternatives like patch-, class- and threshold-based strategies exist, but lack systematic comparison, leading to inconsistent reporting and unclear best practices. We address this gap by (1) formally analyzing properties, limitations, and pitfalls of common strategies; (2) proposing novel strategies that incorporate spatial uncertainty structure and (3) benchmarking their performance on OoD and failure detection across ten datasets that vary in image geometry and structure. We find that aggregators leveraging spatial structure yield stronger performance in both downstream tasks studied. However, the performance of individual aggregators depends heavily on dataset characteristics, so we (4) propose a meta-aggregator that integrates multiple aggregators and performs robustly across datasets.",,,,,,,,,
15,doi:10.3390/app16083745,17.0,forward:+4; year>=2024:+3; keywords:+10,ES2-LeafSeg: Lightweight State Space Modeling-Driven Agricultural Leaf Segmentation,2026,2026-04-10,Hao Wang; Zhiyang Li; Peng Zhao; Jin Yu,Applied Sciences,Applied Sciences,10.3390/app16083745,,,,https://www.semanticscholar.org/paper/daddb44cf68bbdd0aa1627ac080632d697f1bc29,https://www.mdpi.com/2076-3417/16/8/3745/pdf?version=1775830735,True,0,31,semantic_scholar,semantic_scholar:daddb44cf68bbdd0aa1627ac080632d697f1bc29,P008,SoyCotton,forward_citation,1,"Agricultural robots and unmanned farmland management require real-time and precise parsing of crop leaves at the edge to support variable application of pesticides, seedling condition monitoring, and phenotypic analysis. However, the field environment features drastic changes in light, leaf occlusion, and interference from background weeds, which can cause semantic fragmentation and boundary artifacts in lightweight models. This paper presents ES2-LeafSeg, a lightweight framework for leaf semantic segmentation tailored for edge deployment. The method employs EfficientNetV2 as the backbone encoder and introduces the State Space Semantic Enhancement Module (S2FEM) on skip connection features, modeling long-range dependencies and suppressing local texture noise through SSM pooling in row and column directions. Meanwhile, a cross-scale decoder (CSD) and a global context transformation (GCT) are designed to achieve multi-scale semantic fusion and boundary refinement. On the three-class segmentation task of the SoyCotton dataset, ES2-LeafSeg achieved mIoU of 0.817, mDice of 0.869, Fβw of 0.925, and MAE of 0.011, outperforming multiple classic and recent baselines while maintaining 23.67 M parameters and 49.62 FPS. Ablation experiments further verified the complementary contributions of S2FEM and GCT to regional consistency and boundary quality.",,,,,,,,,
16,doi:10.48550/arxiv.2604.09907,17.0,forward:+4; year>=2024:+3; keywords:+10,From UAV Imagery to Agronomic Reasoning: A Multimodal LLM Benchmark for Plant Phenotyping,2026,2026-04-10,Yu Wu; Guangzeng Han; Ibrahima Niang; F. Ravelombola; Maiara Oliveira; Jason A. Davis; Dong Chen; Feng Lin; Xiaolei Huang,arXiv.org,"ArXiv, abs/2604.09907",10.48550/arxiv.2604.09907,2604.09907,,,https://www.semanticscholar.org/paper/e2653d20924f7437c3ec48a2420850cb804e3b82,,False,0,29,semantic_scholar,semantic_scholar:e2653d20924f7437c3ec48a2420850cb804e3b82,P011,PlantSeg,forward_citation,1,"To improve crop genetics, high-throughput, effective and comprehensive phenotyping is a critical prerequisite. While such tasks were traditionally performed manually, recent advances in multimodal foundation models, especially in vision-language models (VLMs), have enabled more automated and robust phenotypic analysis. However, plant science remains a particularly challenging domain for foundation models because it requires domain-specific knowledge, fine-grained visual interpretation, and complex biological and agronomic reasoning. To address this gap, we develop PlantXpert, an evidence-grounded multimodal reasoning benchmark for soybean and cotton phenotyping. Our benchmark provides a structured and reproducible framework for agronomic adaptation of VLMs, and enables controlled comparison between base models and their domain-adapted counterparts. We constructed a dataset comprising 385 digital images and more than 3,000 benchmark samples spanning key plant science domains including disease, pest control, weed management, and yield. The benchmark can assess diverse capabilities including visual expertise, quantitative reasoning, and multi-step agronomic reasoning. A total of 11 state-of-the-art VLMs were evaluated. The results indicate that task-specific fine-tuning leads to substantial improvement in accuracy, with models such as Qwen3-VL-4B and Qwen3-VL-30B achieving up to 78%. At the same time, gains from model scaling diminish beyond a certain capacity, generalization across soybean and cotton remains uneven, and quantitative as well as biologically grounded reasoning continue to pose substantial challenges. These findings suggest that PlantXpert can serve as a foundation for assessing evidence-grounded agronomic reasoning and for advancing multimodal model development in plant science.",,,,,,,,,
17,doi:10.1109/cipher70417.2026.11523795,17.0,forward:+4; year>=2024:+3; keywords:+10,GTAssure: Ground Truth Quality Assurance Framework for Semantic Segmentation in Precision Agriculture,2026,2026-02-13,Udaybhan Rathore; Amit Shakya; Rupesh Kumar; Shruti S. Phutke; Lalit Sharma,"2026 International Conference on Intelligent Processing, Hardware, Electronics, and Radio Systems (CIPHER)","2026 International Conference on Intelligent Processing, Hardware, Electronics, and Radio Systems (CIPHER), 1-6",10.1109/cipher70417.2026.11523795,,,,https://www.semanticscholar.org/paper/443093f0e5e77e0eadf1aed1b981207a5bf95a07,,False,0,21,openalex; semantic_scholar,openalex:W7162006308; semantic_scholar:443093f0e5e77e0eadf1aed1b981207a5bf95a07,P011,PlantSeg,forward_citation,2,"With the growing demand for precision agriculture to minimize food waste, optimize resource and crop management, semantic segmentation plays a critical role in enabling intelligent decision-making. However, achieving high segmentation accuracy on agricultural fields requires real, field-captured datasets. Manual annotation of these datasets is not only time-consuming and labor-intensive but also prone to errors such as missed regions, mislabels, and coarse boundaries, resulting in biased learning and unreliable model performance during training and testing. To address this, we propose GTAssure, an automated framework for ground truth quality inspection that detects and corrects annotation errors, thereby assuring dataset reliability for precision agriculture. The framework employs two correction approaches: the first addresses missed regions and misclassifications errors, while the second targets coarse annotations commonly found in complex agricultural scenes. GTAssure is evaluated across diverse agricultural tasks, including leaf disease, fruit, and crop–weed segmentation, using five challenging real-world datasets: NLB, LDSD, MinneApple, WGISD, and CWFID. The proposed framework significantly enhances models reliability and accuracy using expert-verified, refined ground truth, demonstrating consistent IoU improvements ranging from 0.68% to 5.13% across all experimental datasets, establishing a new benchmark for high-quality annotations in precision agriculture. Code will be made publicly available once the paper is accepted.",,,,,,,,,
