rank,candidate_id,title,year,authors,venue,doi,arxiv_id,pmid,pmcid,providers,provider_ids,seed_ids,dataset_names,directions,is_open_access,landing_url,pdf_url,abstract
233,doi:10.1109/cvpr.2019.00086,PointRCNN: 3D Object Proposal Generation and Detection From Point Cloud,2018,Shaoshuai Shi; Xiaogang Wang; Hongsheng Li,Computer Vision and Pattern Recognition,10.1109/cvpr.2019.00086,1812.04244,,,openalex; semantic_scholar,openalex:W2949708697; semantic_scholar:7ce6eca495909de2ffa0b6d9c16993757208764e,P006,Annotated 3D Point Cloud Dataset of Broad-Leaf Legumes,backward_reference,False,https://www.semanticscholar.org/paper/7ce6eca495909de2ffa0b6d9c16993757208764e,https://arxiv.org/pdf/1812.04244,"In this paper, we propose PointRCNN for 3D object detection from raw point cloud. The whole framework is composed of two stages: stage-1 for the bottom-up 3D proposal generation and stage-2 for refining proposals in the canonical coordinates to obtain the final detection results. Instead of generating proposals from RGB image or projecting point cloud to bird's view or voxels as previous methods do, our stage-1 sub-network directly generates a small number of high-quality 3D proposals from point cloud in a bottom-up manner via segmenting the point cloud of the whole scene into foreground points and background. The stage-2 sub-network transforms the pooled points of each proposal to canonical coordinates to learn better local spatial features, which is combined with global semantic features of each point learned in stage-1 for accurate box refinement and confidence prediction. Extensive experiments on the 3D detection benchmark of KITTI dataset show that our proposed architecture outperforms state-of-the-art methods with remarkable margins by using only point cloud as input. The code is available at https://github.com/sshaoshuai/PointRCNN."
234,doi:10.1109/cvpr.2017.660,Pyramid Scene Parsing Network,2016,Hengshuang Zhao; Jianping Shi; Xiaojuan Qi; Xiaogang Wang; Jiaya Jia,Computer Vision and Pattern Recognition,10.1109/cvpr.2017.660,1612.01105,,,openalex; semantic_scholar,openalex:W2560023338; semantic_scholar:1031a69923b80ad01cf3fbb703d10757a80e699b,P007; P010; P011,BAWSeg; PlantSeg; WeedsGalore,backward_reference,False,https://www.semanticscholar.org/paper/1031a69923b80ad01cf3fbb703d10757a80e699b,https://arxiv.org/pdf/1612.01105,"Scene parsing is challenging for unrestricted open vocabulary and diverse scenes. In this paper, we exploit the capability of global context information by different-region-based context aggregation through our pyramid pooling module together with the proposed pyramid scene parsing network (PSPNet). Our global prior representation is effective to produce good quality results on the scene parsing task, while PSPNet provides a superior framework for pixel-level prediction. The proposed approach achieves state-of-the-art performance on various datasets. It came first in ImageNet scene parsing challenge 2016, PASCAL VOC 2012 benchmark and Cityscapes benchmark. A single PSPNet yields the new record of mIoU accuracy 85.4% on PASCAL VOC 2012 and accuracy 80.2% on Cityscapes."
235,doi:10.1109/cvpr.2016.90,Deep Residual Learning for Image Recognition,2015,Kaiming He; Xiangyu Zhang; Shaoqing Ren; Jian Sun,Computer Vision and Pattern Recognition,10.1109/cvpr.2016.90,1512.03385,,,openalex; semantic_scholar,openalex:W2194775991; semantic_scholar:2c03df8b48bf3fa39054345bafabfeff15bfd11d,P010; P011; P012,MFWD; PlantSeg; WeedsGalore,backward_reference,True,https://www.semanticscholar.org/paper/2c03df8b48bf3fa39054345bafabfeff15bfd11d,https://repositorio.unal.edu.co/bitstream/unal/81443/1/98670607.2022.pdf,"Deeper neural networks are more difficult to train. We present a residual learning framework to ease the training of networks that are substantially deeper than those used previously. We explicitly reformulate the layers as learning residual functions with reference to the layer inputs, instead of learning unreferenced functions. We provide comprehensive empirical evidence showing that these residual networks are easier to optimize, and can gain accuracy from considerably increased depth. On the ImageNet dataset we evaluate residual nets with a depth of up to 152 layers - 8× deeper than VGG nets [40] but still having lower complexity. An ensemble of these residual nets achieves 3.57% error on the ImageNet test set. This result won the 1st place on the ILSVRC 2015 classification task. We also present analysis on CIFAR-10 with 100 and 1000 layers. The depth of representations is of central importance for many visual recognition tasks. Solely due to our extremely deep representations, we obtain a 28% relative improvement on the COCO object detection dataset. Deep residual nets are foundations of our submissions to ILSVRC & COCO 2015 competitions1, where we also won the 1st places on the tasks of ImageNet detection, ImageNet localization, COCO detection, and COCO segmentation."
236,doi:10.1007/978-3-319-10602-1_48,Microsoft COCO: Common Objects in Context,2014,Tsung-Yi Lin; Michael Maire; Serge Belongie; James Hays; Pietro Perona; Deva Ramanan; Piotr Dollár; C. Lawrence Zitnick,European Conference on Computer Vision,10.1007/978-3-319-10602-1_48,1405.0312,,,openalex; semantic_scholar,openalex:W1861492603; semantic_scholar:71b7178df5d2b112d07e45038cb5637208659ff7,P004; P010; P011,MFO / Modern Fruit Orchards; PlantSeg; WeedsGalore,backward_reference,True,https://www.semanticscholar.org/paper/71b7178df5d2b112d07e45038cb5637208659ff7,https://link.springer.com/content/pdf/10.1007%2F978-3-319-10602-1_48.pdf,"We present a new dataset with the goal of advancing the state-of-the-art in object recognition by placing the question of object recognition in the context of the broader question of scene understanding. This is achieved by gathering images of complex everyday scenes containing common objects in their natural context. Objects are labeled using per-instance segmentations to aid in precise object localization. Our dataset contains photos of 91 objects types that would be easily recognizable by a 4 year old. With a total of 2.5 million labeled instances in 328k images, the creation of our dataset drew upon extensive crowd worker involvement via novel user interfaces for category detection, instance spotting and instance segmentation. We present a detailed statistical analysis of the dataset in comparison to PASCAL, ImageNet, and SUN. Finally, we provide baseline performance analysis for bounding box and segmentation detection results using a Deformable Parts Model."
237,doi:10.1109/siu59756.2023.10223838,PLANesT-3D: A New Annotated Data Set of 3D Color Point Clouds of Plants,2023,Kerem Mertoğlu; Yusuf Şalk; Server Karahan Sarıkaya; Kaya Turgut; Yasemin Evrenosoğlu; Hakan Çevıkalp; Ömer Nezih Gerek; Helin Dutağacı; David Rousseau,,10.1109/siu59756.2023.10223838,,,,openalex,openalex:W4386212573,P009,TomatoWUR,backward_reference,False,https://doi.org/10.1109/siu59756.2023.10223838,,"In this paper, we introduce a new data set, named as PLANesT-3D, which includes complete 3D color point clouds of plants. PLANesT-3D is composed of 34 point clouds acquired from three different plant species: Pepper, rosebush and ribes. The point clouds were reconstructed from 2D color images of real plants through multiview stereo. Through a semi-automatic process, background and noise removal was performed. The point clouds were scaled to their true metric dimensions and brought to a particular pose. Each point in the point clouds was manually labeled into “leaf” and “stem” classes. Also, each leaf instance was assigned a leaf identification number. In order to provide benchmark semantic segmentation performance, segmentation results obtained with the application of PointNet++ are reported. We believe that PLANesT-3D data set will contribute to the development and assessment of segmentation methods that operate on 3D color plant point clouds."
238,doi:10.1093/jxb/erv345,Plant phenomics and the need for physiological phenotyping across scales to narrow the genotype-to-phenotype knowledge gap.,2015,Dominik K. Großkinsky; Jesper Svensgaard; Svend Christensen; Thomas Roitsch,Journal of Experimental Botany,10.1093/jxb/erv345,,26163702,,openalex; semantic_scholar,openalex:W2127293692; semantic_scholar:10d868fd53433b5a718741e5630d6efb9da351b7,P013,TomatoPGT ecosystem,backward_reference,True,https://www.semanticscholar.org/paper/10d868fd53433b5a718741e5630d6efb9da351b7,https://academic.oup.com/jxb/article-pdf/66/18/5429/18044752/erv345.pdf,"Plants are affected by complex genome×environment×management interactions which determine phenotypic plasticity as a result of the variability of genetic components. Whereas great advances have been made in the cost-efficient and high-throughput analyses of genetic information and non-invasive phenotyping, the large-scale analyses of the underlying physiological mechanisms lag behind. The external phenotype is determined by the sum of the complex interactions of metabolic pathways and intracellular regulatory networks that is reflected in an internal, physiological, and biochemical phenotype. These various scales of dynamic physiological responses need to be considered, and genotyping and external phenotyping should be linked to the physiology at the cellular and tissue level. A high-dimensional physiological phenotyping across scales is needed that integrates the precise characterization of the internal phenotype into high-throughput phenotyping of whole plants and canopies. By this means, complex traits can be broken down into individual components of physiological traits. Since the higher resolution of physiological phenotyping by 'wet chemistry' is inherently limited in throughput, high-throughput non-invasive phenotyping needs to be validated and verified across scales to be used as proxy for the underlying processes. Armed with this interdisciplinary and multidimensional phenomics approach, plant physiology, non-invasive phenotyping, and functional genomics will complement each other, ultimately enabling the in silico assessment of responses under defined environments with advanced crop models. This will allow generation of robust physiological predictors also for complex traits to bridge the knowledge gap between genotype and phenotype for applications in breeding, precision farming, and basic research."
239,doi:10.1016/j.aiia.2024.06.002,Image classification on smart agriculture platforms: Systematic literature review,2024,Juan Felipe Restrepo-Arias; John W. Branch; Gabriel Awad,Artificial Intelligence in Agriculture,10.1016/j.aiia.2024.06.002,,,,openalex,openalex:W4399466600,P003,AgriVision,backward_reference,True,https://doi.org/10.1016/j.aiia.2024.06.002,,"In recent years, smart agriculture has gained strength due to the application of industry 4.0 technologies in agriculture. As a result, efforts are increasing in proposing artificial vision applications to solve many problems. However, many of these applications are developed separately. Many academic works have proposed solutions integrating image classification techniques through IoT platforms. For this reason, this paper aims to answer the following research questions: (1) What are the main problems to be solved with smart farming IoT platforms that incorporate images? (2) What are the main strategies for incorporating image classification methods in smart agriculture IoT platforms? and (3) What are the main image acquisition, preprocessing, transmission, and classification technologies used in smart agriculture IoT platforms? This study adopts a Systematic Literature Review (SLR) approach. We searched Scopus, Web of Science, IEEE Xplore, and Springer Link databases from January 2018 to July 2022. From which we could identify five domains corresponding to (1) disease and pest detection, (2) crop growth and health monitoring, (3) irrigation and crop protection management, (4) intrusion detection, and (5) fruits and plant counting. There are three types of strategies to integrate image data into smart agriculture IoT platforms: (1) classification process in the edge, (2) classification process in the cloud, and (3) classification process combined. The main advantage of the first is obtaining data in real-time, and its main disadvantage is the cost of implementation. On the other hand, the main advantage of the second is the ability to process high-resolution images, and its main disadvantage is the need for high-bandwidth connectivity. Finally, the mixed strategy can significantly benefit infrastructure investment, but most works are experimental."
240,doi:10.3390/s24227266,MFMamba: A Mamba-Based Multi-Modal Fusion Network for Semantic Segmentation of Remote Sensing Images,2024,Yan Wang; Li Cao; He Deng,Sensors,10.3390/s24227266,,39599043,,openalex,openalex:W4404304230,P007,BAWSeg,backward_reference,True,https://doi.org/10.3390/s24227266,https://www.mdpi.com/1424-8220/24/22/7266/pdf?version=1731570328,"Semantic segmentation of remote sensing images is a fundamental task in computer vision, holding substantial relevance in applications such as land cover surveys, environmental protection, and urban building planning. In recent years, multi-modal fusion-based models have garnered considerable attention, exhibiting superior segmentation performance when compared with traditional single-modal techniques. Nonetheless, the majority of these multi-modal models, which rely on Convolutional Neural Networks (CNNs) or Vision Transformers (ViTs) for feature fusion, face limitations in terms of remote modeling capabilities or computational complexity. This paper presents a novel Mamba-based multi-modal fusion network called MFMamba for semantic segmentation of remote sensing images. Specifically, the network employs a dual-branch encoding structure, consisting of a CNN-based main encoder for extracting local features from high-resolution remote sensing images (HRRSIs) and of a Mamba-based auxiliary encoder for capturing global features on its corresponding digital surface model (DSM). To capitalize on the distinct attributes of the multi-modal remote sensing data from both branches, a feature fusion block (FFB) is designed to synergistically enhance and integrate the features extracted from the dual-branch structure at each stage. Extensive experiments on the Vaihingen and the Potsdam datasets have verified the effectiveness and superiority of MFMamba in semantic segmentation of remote sensing images. Compared with state-of-the-art methods, MFMamba achieves higher overall accuracy (OA) and a higher mean F1 score (mF1) and mean intersection over union (mIoU), while maintaining low computational complexity."
